claim,label
Migrantengangs lieferten sich Straßenschlacht in Wiesbaden. Unsere Städte sind clanbeherrschte Gefahrenzonen.,mostly true
Suudi Arabistan'da şişme havuz reklamındakilerin sansürlendiği iddiası,true
۲ درصد از کل صفحات وب دنیا به زبان فارسی‌ است و در این حوزه زبان فارسی از عربی و چینی پیشی گرفته است,mostly true
Geçen yıl gerçekleşen birleşme ve satın alma işlemlerine bakıldığında yabancı sayısı son 8 yılın en düşük seviyesinde oldu. Yerli ve yabancı yatırımcı işlem hacmi de Türkiye potansiyelinin çok altına indi.,true
Videoda silah kullanan genç kız Greta Thunberg değil,false
Uzungöl fotoğrafları ve gölün etrafındaki yapılaşma iddiası,true
"AK Parti, geçmiş 13 yılda gösterdi ki bu ülkeyi borçlu ülkeden borçsuz ülkeye getirdi.",false
Kayseri Uçak Fabrikası ve fabrikada üretilen uçaklarla ilgili iddialar,mostly false
"Unter der Überschrift „Deutsche Linke empört: Israel gewinnt ESC” schreibt der Autor Ramiro Fulano in seinem Satire-Artikel über vermeintliche Kritik von Medien, Gewerkschaften, SPD, Grünen und Linken an dem israelischen Sieg beim Eurovision Songcontest (ESC).",mostly true
"Bugün 178 tane ülke içinde Türkiye'nin kırılganlık endeksine, küresel endekse baktığımız zaman 112'de. Bizden daha iyi kimler var? Senegal, Cezayir, Nikaragua bunlar bizden daha az kırılgan",true
"3 Ekim'den beri TL'nin kaybettiği değer, aynı dönem içinde Rus rublesinin kaybettiği değerden üç kat daha fazla.",true
Almanya genelinde ders kitaplarının kiralanıp yıllarca kullanılabildiği iddiası,mostly false
سپاه صداقت مثال‌زدنی نشان داد. هیچ یک از کشورهای ساقط‌ کننده هواپیماهای مسافربری مسئولیت اقدام خود را برعهده نگرفته‌اند.,mostly false
"Klimafakten: 85 % sämtlicher Emissionen werden von drei Ländern erzeugt: China, Indien und den USA; Der Anteil des von Deutschland ausgestoßen CO2 beträgt im Verhältnis zum Gesamtvorkommen des CO2 in der Luft 0,0004712 Prozent.",mostly false
5G-Strahlung tötet Vögel in Kroatien,false
İstanbul Valiliği’ndeki tadilat için 3 milyon liradan fazla bedelli ihale yapıldığı iddiası,true
"Almanya, 700 milyar € ayırmış biz 15 milyar $ ayırmışız. Almanya ekonomisi bizim 4 katımız. Ama ayırdığı para 50 katı. Yani nüfusu aynı, ekonomik olarak 4 kat büyüklükte iki ülke var. Nüfuslar aynı ama Türkiye, Almanya’nın 50’de 1’i kadar para ayırmış bu işe.",mostly true
Göktürk'te ağaçların gençleştirme bahanesiyle farklı bir amaç için kesildiği iddiası,mostly false
Angela Merkel hofft auf 12 Millionen Einwanderer.,mostly false
Deutscher erhält 10 Jahre Haftstrafe für Silvester-Böller – ein IS-Mörder nur 22 Monate Bewährung.,mostly false
17 yılda depremle ilgili 58 araştırma önergesi vermişiz. (Parlamento olarak) AK Parti ve MHP milletvekilleri ‘hayır depremi araştırmaya gerek yok’ demişler.,mostly false
"Dünyanın ortalama büyümesi yüzde 4,7, İslam toplumunun ortalama büyümesi ise 3,6. Bütün bu kaynaklara rağmen 3,6.",mostly false
A Haber’in seçim analisti olarak ekrana çıkardığı Kenan Demir'in kebapçı olduğu iddiası,true
Mutmaßlicher Täter des Anschlags von Hanau sei kein politisch motivierter Extremist,mostly false
Die soll einen Polizei hat Terroranschlag auf den Berliner Halbmarathon vereitelt haben.,mostly false
Çocuk sayısı 1 milyon 200 bin. Sadece 0-4 yaş arası. Çocuk nüfusuyla Avrupa’nın en büyük iki üç kentinden birisiyiz,true
Richtig scharfer Wahlkampf: CDU verteilt in Hessen Messer als Werbegeschenke an Merkels Gäste,mostly false
Gana’da sahte ABD Büyükelçiliği açıldığı iddiası,true
Halal-Schlachtung im Multikultiviertel. Polizei stürmt Wohnung.,mostly true
Fındığın alım fiyatı 13 yıl önce 5 dolar iken şu anda 2 dolar bile değil.,mostly true
Bütün üniversitelerimize ayrılan ödenek yılda sadece 36 milyar TL. Bir tek Stanford'un bütçesi bu yıl 60 Milyar TL. Aldığınız borçların faizinin yıllık maliyeti 140 milyar TL,true
Der muskulöse Mann sei ein Flüchtling von der „Sea-Watch 3“,false
گران‌ترین هزینه‌های ازدواج مربوط به ایران است.,false
Jeder zweite Deutsche verdient weniger als 2.500 Euro brutto,mostly false
Dünyada en çok mülteciye ev sahipliği yapan ülke Türkiye. Milli gelire oranla dünyada en fazla insani kalkınma yardımı yapan ülke biz olduk.,mostly true
1980-2002 arası Türkiye’nin ödediği faiz 135 milyar lira. 2002-2014 arası ödediği faiz ise 598 milyar lira,mostly true
"Bu yıl kamu ve özel sektör yatırımlarının tutarı, tarihimizde ilk defa 1 trilyon lirayı aşacak. Bu da 2002 yılına göre yaklaşık 4 katlık bir artışı ifade ediyor.",mostly false
"CDU macht Wahlwerbung mit schwarzer Familie, deutsche Familien sollen es kinderleichter haben.",false
Jeder Vierte Berliner ist ein Ausländer” titelt die Berliner Zeitung „B.Z.”.,mostly true
Noel Babalı videonun Ankara Gölbaşı'nda çekildiği iddiası,false
„Experte: Migranten aus Afrika sind keine Flüchtlinge nach Genfer Konvention“,false
"Doğan bir çocuk için beklenen hayat süresi 72’den 78’e çıktı. Hamile annelerin vefat etmesi 100 bin annede 70’lerden 15’lere geriledi. Bebek ölüm hızları binde 30’lardan binde 7’lere, 7 buçuklara geriledi.",mostly true
Biz şu anda yurt içindeki kuyulardan yaklaşık 50 bin varil petrol elde ediyoruz.,mostly true
Behinderung von Straßenverkehr durch Fahrräder,mostly false
"İstanbul dünyanın en çok nüfusa sahip 15. kenti, GSYH’nin dörtte birini üreten, vergilerin %40'ını veren, tek başına bir ülke olsaydı dünyanın en büyük 25-30 ekonomisinden biri olurdu.",mostly true
Çin'in Ay'a götürdüğü pamuk tohumlarının filizlendiği iddiası,true
Dünyada hem istihdamı düşürüp hem işsizliği azaltan tek ülke herhâlde Türkiye’dir,false
"Türkiye havacılıkta dünyada 11., Avrupa’da 5. sıraya yükseldi. THY Avrupa’nın 2. büyük şirketi haline geldi.",mostly true
Hastanelerdeki yatak sayısını 2002’den bu yana iki katına çıkardık. Şu anda 227 bin yatak kapasitesine sahibiz. Nitelikli yatak sayısını da 19 binden 127 bine çıkarmış durumdayız.,mostly false
سلمان رشدی در منچستر خودکشی کرد!,false
"Eine WHO-Regionaldirektorin soll gesagt haben, dass es keine zweite Corona-Welle gebe.",mostly false
Erdoğan'ın Suriyelilere kitlesel vatandaşlık vermesinin modern dünyada eşi yok.,mostly true
"Der Vizepräsident der EU-Kommission fordert, monokulturelle Staaten auszuradieren",false
Autofahrer sollen künftig alle fünf Jahre zur Führerscheinprüfung,false
"Çin’in, İsrail’in ihracatının üçte birini, yüksek teknolojili ürünler oluştururken, bizim ihracatımızda, yüksek teknolojili ürünlerin oranı yüzde beş bile değil",mostly true
Kanada’da vatandaşların pandemi yardımını geri çevirdiği iddiası,mostly false
"2002'de 405.882 aile tütünden geçiniyordu. 2015'te 7 kat küçüldü, 56 bine düştü. 2012'den başlayarak Türkiye net tütün ithalatçısı haline geldi.",true
"2017’de tarımsal kesime 12,7 milyar lira destek verildi; aynı dönemde 8 ürünün ithalatına 20,6 milyar ödeme yapıldı.",true
Fotoğraf Covid-19 nedeniyle vefat eden babanın çocuğuyla son görüşmesini göstermiyor,false
"Çin’in, İsrail’in ihracatının üçte birini, yüksek teknolojili ürünler oluştururken, bizim ihracatımızda, yüksek teknolojili ürünlerin oranı yüzde beş bile değil",mostly true
„Strahlende“ Lebensmittel aus #Fukushima,mostly true
Devletin ihalesiz alımı % 71 yükseldi,true
"Önceki yıl 7 bin, geçen yıl 5 bin megavat yeni üretim tesisi kurulmuş.",mostly false
Bundswehr schickt Panzer zur Corona-Demonstration nach Berlin,false
Video von Schlägerei in Berlin-Neukölln,true
درآمد پزشکان ایرانی (با احتساب برابری قدرت خرید) بیش از همه جای دنیا است.,mostly true
"AKP iktidarda olduğu 15 yılda toplam yağlı tohum ve türevleri ithalatını 2 milyon tondan 6,5 milyon tona yükseltmiştir. Yağlı tohumlarda tamamen dışa bağımlı olan Türkiye, üretimini artırmak zorundadır.",true
Das BAMF sucht per Stellenanzeige Statisten für Demos gegen rechts und Proteste gegen Abschiebungen.,false
Fotoğrafın 51 yaşındaki Suudi Prens Kahtani ve 7 yaşındaki eşini gösterdiği iddiası,false
HIV-Rate liegt in Subsahara-Afrika teils bei 90 Prozent. Außerdem ist HIV Afrikas Todesursache Nummer eins.,false
"Anayasa Mahkemesine 23 Eylül 2012 tarihinden, 10 Nisan 2015 tarihine kadar 38 bin 67 başvuru yapıldı. Bunlar içerisinde en çok ihlal edilen hak, 34 bin 482 başvuruyla adil yargılanma hakkı.",true
یک شبکه جاسوسی سیا را در ایران و کشورهای دیگر شناسایی و متلاشی کردیم و رئیس سیا و رسانه‌های غربی نیز این اتفاق را تایید کرده‌اند.,mostly true
"Ücretsiz aile işçisi çocukların sayısı 362 binden, 413 bine çıktı",true
"Son 15 yılın performansına bakıyorum, her alanda olduğu gibi tarım alanında da 3-4 misli büyümemiz olmuş.",mostly true
Cumhurbaşkanlığı Külliyesi’nin 1 dakikalık masrafı bir asgari ücret ile aynı.,true
Türkiye Avrupa’da boşanma hızının en düşük olduğu ülkeler arasında.,mostly true
Ekim 2016’da işsizlik oranı Türkiye’de Mart 2010’dan bu yana kaydedilen en yüksek işsizlik oranına tekabül etmiştir.,false
"Üniversitelerde görev yapan kadın öğretim üyesi oranı Türkiye’de yüzde 29,5, Avrupa Birliği’nde yüzde 15 civarında.",mostly false
"Baro seçimlerine katılım %40-%45, en fazla %50 civarında",false
Spritzen in Bus- und Bahnsitzen stechen und infizieren Menschen,mostly false
US-Gericht verurteilt Iran ohne Beweise und handelt im Interesse Saudi-Arabiens,mostly false
"Dünya Bankası'nın değerlendirme çalışmasına göre, Türkiye hukukun üstünlüğünde 18 sıra geriye gitti, 209 ülke arasında 108. sırada yer aldı.",true
okuma yazma oranınımız neredeyse yüzde 100'lere yaklaştı,mostly true
Periyodik tablonun mucidi Çanakkale Savaşı'nda öldürüldü iddiası,mostly false
Volles Haus Diätenerhöhung,false
Arabischer Armutsflüchtling vergewaligt Mädchen (15)- Polizei Bremen vertuscht mehr als 1 Jahr!,false
Polizist trägt Aufnäher bei Einsatz in Ostritz,true
"Türkiye’de demiryollarında 2002 yılında 74 milyon kişi taşınırken 2013 yılında 46 milyon taşındı. İnsanlar karayoluna mahkum oldu, kazalar arttı",mostly true
"Türkiye’de meslek liselerinin oranı yüzde 44, imam hatip okullarının oranı ise yüzde 13-14 düzeyinde.",mostly false
„Die Kriminalitätsrate in Deutschland explodiert“,false
(Kadın) cinayetlerde de üst sıradayız.,mostly true
Şilili reklamcı Ferrada'nın Hayır kampanyası hakkında söylediği iddia edilen sözler,mostly false
UN will Pädophilie legalisieren,mostly false
"Türkiye'nin 2016 ilk çeyrek itibarıyla toplam dış borcu 411.5 milyar dolardı. AKP iktidara geldiğinde, 2003’te, 124 milyar dolardı. Her doğan çocuk 5.137 dolar borçla dünyaya geliyor.",mostly true
MEB'in dağıttığı altıncı sınıf Sosyal Bilgiler Kitabı'nda kullanılan bir görselde Uygur alfabesi yerine İbrani alfabesi kullanıldığı iddiası,true
Suriyeli sığınmacıların ülke içinde istedikleri gibi yer değiştirebilecekleri iddiası,false
جنگ اقتصادی که آمریکا تحت عنوان تحریم‌های تازه، آغاز کرده نه تنها مردم ایران را هدف قرار داده، بلکه آثار زیان‌باری برای مردم کشورهای دیگر داشته و در روند تجارت جهانی، اخلال کرده است.,false
... son 3 yılda hırsızlık ve yolsuzluk gibi olaylar yüzde 68 nispetinde artarak 50 binden 84 bine ulaştı.,mostly true
"Nüfusumuzun yüzde 39,7'si sızdıran çatı, nemli duvar, çürümüş penceresi olan konutta oturmaktadır.",true
In Dänemark darf die Polizei einige Hunderassen töten lassen - auch Hunde von Touristen,mostly true
Erdoğan'ın Suriyelilere kitlesel vatandaşlık vermesinin modern dünyada eşi yok.,mostly true
"Avrupa'da % 27 olan dolaylı vergi oranı Türkiye'de % 69 ile rekor seviyeye ulaştı.Yani Türkiye'de dolaylı vergiler Avrupa Birliğinin 2,5 katı.",mostly true
اسپیلبرگ گفته «نجات سرباز رایان» را تحت تاثیر «روایت فتح» آوینی ساخته است.,false
Der psychisch Kranke Straftäter Otto K. ist auf der Flucht,false
"Maastricht kriterlerine (Avro’ya geçmek için gerekli olan) Avrupa’da iki ülke uyuyor, birisi Almanya birisi Türkiye.",false
"2010-2014 arası ortalama yüzde 5,4 büyüme sağlandı. Geçen yılki yüzde 4’lük büyüme, birçok yükselen ekonominin iki katından fazla.",mostly false
'Herkese Umut' projesi kapsamında Suriyeli sığınmacıların devlet memuru olabileceği iddiası,mostly false
Grüne: Kerzenverbot in Innenräumen,false
Türkiye'deki enerjinin yaklaşık yüzde 70'i dışa bağımlı durumda.,true
Bir milyon 350 bin Suriyeli var ve hiçbir kontrol ve kayıt yok,mostly true
"Bu iktidar elinde, iki Trakya’dan daha büyük bir alan artık ekilip biçilmiyor.",mostly true
"Jeder zweite Rentner in Deutschland erhält monatlich weniger als 800 Euro, gleichzeitig müssen Gesetzgeber „kaum Steuern“ bezahlen und bekommen eine „fette Pension“",mostly false
AK Parti'nin afişinde “Deh de gidelim... Çüş de duralım...” yazdığı iddiası,false
Türkiye’de ilk aşı kampanyasının 1985’te yapıldığı iddiası,false
Aussagen zur CO2-Bilanz von Haustieren wie Hunde und Katzen,mostly true
"„In China ist nun auch das Hanta-Virus ausgebrochen, erster Toter in Yunnan“",false
Dalai Lama: Europa gehört den Europäern und Flüchtlinge müssen nach Hause gehen,mostly true
Angeblich Menschenfleisch in McDonalds Burgern gefunden,false
در ایران به ازای هر ۱۰ هزار نفر بین ۱۱ تا ۱۶ پزشک مشغول فعالیت‌اند و از این نظر ایران وضعیتی بدتر از سوریه، قرقیزستان و مغولستان دارد.,true
Arda Turan’ın ünlü menajer Mino Raiola’dan kendisine kulüp bulmasını istediği iddiası,false
Corona-Warn-App nutze Telefonnummer zur Identifizierung der Nutzer,false
"(Küresel ısınmanın Türkiye üzerine etkisi hakkında) Türkiye genelinde yağış miktarı geçen yıl ortalamalarına göre yüzde 37,5 oranında azaldı",mostly true
"Henriette Reker sagt es gäbe weniger Vergewaltigungen, wenn Frauen zuhause bleiben würde",false
İBB Başkan Adaylarının ortak canlı yayınında en çok hangi kelimeler kullanıldı?,false
„Die Simpsons“ haben den Brand der Notre-Dame vorhergesehen,false
"HDP, Türkiye’nin en yoksul mahallelerinden, İstanbul’un en fukara semtlerinden oy almıştır.",true
"65 yaş ve üzerindeki nüfus 7 milyona yaklaşırken, huzur evleri sayı, kapasite ve ülkeye dağılım bakımından yetersiz kalmıştır.",true
"Angeblicher Fyler „Kein Sex mit Nazi“, gefördert durch Bundesfamilienministerium",mostly true
"Menschen, die ins Rentensystem einzahlen, bekommen nur 48% Rente, aber Beamte, die da nicht einzahlen, über 70%",mostly false
Palandöken'de yapımı süren nikah sarayının 22 milyon TL maliyeti olduğu iddiası,true
"Shakira sagt Konzert in Israel ab, als eine Reaktion gegen das Massaker Israels an Gaza.",false
"Irreführende Behauptungen zur Wirksamkeit von Masken, PCR-Tests und Impfstoffen",mostly false
Türkiye’de cezaevlerinde annesiyle birlikte kalan 6 yaş altındaki çocuk sayısı 594.,true
Aussagen aus dem AfD-Wahlprogramm für Sachsen,mostly true
Rossmann-Drogerie ändert sein Namen in Rossfrau.,mostly true
2011'de milletvekili oldum. Çeşitli zamanlarda (depremle ilgili) araştırma önergesi verdim. Hepsi reddedildi araştırma önerilerimin,true
Uluslararası yatırımcıların önemli bölümü ülkemize yaptıkları yatırımları artırarak sürdürüyor.,false
Harita Çin’de koronavirüs sebebiyle 50 bin kişi yakıldığını göstermiyor,false
Zitate von AfD-Politikern und AfD-Mitarbeitern,mostly true
Kızılay’ın Başkent Gaz’ın yaptığı bağışla Ensar Vakfı’yla proje yürüttüğü iddiası,true
"Türkiye'nin 2002’de 130 milyar dolar olan brüt dış borcu 2016'nın ilk yarısı itibariyle 421.4 milyar dolara yükseldi, AK Parti hükümetleri döneminde Türkiye'nin dış borcu yüzde 225.2 oranında arttı.",true
HDP barajı aşsa bile şu anki parlamento tablosu değişecek durumda değil.,mostly false
"Cari açık, tarihi şekilde iyileşmeye devam ediyor.",false
"Şu anda dünyada üniversiteye erişim bakımından ikinci sıradayız, bu son 12 yılda oldu.",true
Kümbetin arkasına öğrenci yurdu yapıldığı iddiası,true
"Die Corona-Maßnahmen der Regierung waren unnötig und unwirksam, das zeigt die Reproduktionszahl des Virus",mostly false
Ailelerin cebinden hastanelere giden para miktarı yüzde 1136 gibi fahiş bir artış gösterdi.,true
Tipps eines italienischen Arztes zum Coronavirus,mostly false
Paradigmenwechsel: US-Regierung setzt auf alternative Therapien statt Impfungen!,mostly false
İzmir ve Eskişehir Büyükşehir Belediyeleri'nin isim levhalarında T.C. yazmadığı iddiası,mostly false
"„Gelbwesten Deutschland“ verbreitet einen Leserbrief und suggeriert, dass alle Asylbewerber Privatpatienten seien und deren Privilegien genießen würden",false
Corona – Geheimplan der Regierung entdeckt?,mostly false
"Bugün 178 tane ülke içinde Türkiye'nin kırılganlık endeksine, küresel endekse baktığımız zaman 112'de. Bizden daha iyi kimler var? Senegal, Cezayir, Nikaragua bunlar bizden daha az kırılgan",true
"Syrer in Gaststätte kennengelernt und auf Heimweg sofort brutal vergewaltigt . Laut Statistiken sind vor allem Muslime und Afrikaner für Vergewaltigungen, Mord und Totschlag verantwortlich.",mostly false
Koruyucu aile sayısı geçen yıllar itibariyle yaklaşık 10 kat arttı.,mostly false
Türkiye her yıl 50 milyar faiz gideri ödüyor.,mostly true
"Dolar, OHAL ilan edilmeden önce 2 lira 90 kuruştu, şimdi 4 lira 90 kuruşa kadar çıktı OHAL’in sonunda. Euro 3 lira 20 kuruştu, 5 lira 80 kuruşa kadar çıktı.",mostly true
100 gençten 27’si hem okula gitmiyor hem de çalışmıyor.,mostly true
Şu anda Türkiye'de toplam 18 bireysel emeklilik şirketi var. Bunlardan 14'ü yabancı…,mostly false
iPhone-Besitzer sind automatisch als Organspender registriert,mostly false
ABD ve Avrupa’da Augmentin’in evcil hayvanlarda kullanımının yasaklandığı iddiası,false
Türkiye'de 2002'de faaliyet gösteren 5.600 yabancı veya küresel sermayeli şirket varken bugün bu sayı 56 binin üzerine çıkmış. 10 kattan fazla bir artıştan bahsediyoruz.,true
187 sexuelle Übergriffe auf Chemnitzer Anti-Rassismus-Konzert.,false
2002 yılına kadar savunma sanayinin yüzde 80’i ithalatla karşılanıyordu.,mostly true
Linke gegen Untersuchungsausschuß zum BAMF-Skandal,true
طبق نظرسنجی سایت رتبه‌بندی داوران فدراسیون جهانی فوتبال (فیفا)، علیرضا فغانی داور ایرانی در صدر داوران جام جهانی ۲۰۱۸ قرار دارد,mostly false
"Avrupa’da pek çok başkent on milyonlarla ifade edilen turist alırken,  Ankara’ya gelen turist sayısı yarım milyonu dahi bulmamaktadır. Avrupa başkentleri turizmden milyarlarca dolar kazanırken, Ankara sadece bu tabloyu seyretmektedir.",mostly true
İmalat sanayinin gayri safi milli hasılada payı yüzde 23'ten yüzde 15'e geriledi.,mostly true
"Bir zamanlar 1 milyon lira varmış. Sonra 6 sıfır atılmış, 1 lira olmuş 1 milyon lira. O zamanlar 1 milyon lira ile 78 gram et alınabiliyormuş. Şimdinin 1 lirası ile 25 gram!",mostly true
Avrupa’nın son 4 yılda aldığı mülteciyi biz bir haftada almışız,mostly true
İşsizlik geldi yüzde 12’ye dayandı. Hiçbir kriz döneminde bu kadar yüksek işsizlik olmamıştı.,mostly false
Schweizerisches Labor: Skripal-Gift stammt aus NATO-Arsenal,mostly false
"5,5 Jahre Haft für Vergewaltigung einer 9-Jährigen, 10 Jahre für „Böller an Moscheetür“",mostly false
20 Asylwerber traten in Hungerstreik: Sie fordern 2.000 Euro netto Taschengeld,mostly true
Amerika Birleşik Devletleri’nde ve Almanya’daki yerli kömürlerinden üretilen elektrik oranı yüzde 43’ler civarında.,mostly false
Suudi Arabistan’da bazı ürünlerin üstüne 'Dokunmayın Türk ürünü' yazıldığı iddiası,true
Coronavirus befällt ersten Hund,mostly true
"Temmuz'da 31 milyon 135 bin yurttaşımız iş hayatının, işgücünün dışında kalmış. Buna karşın işgücüne katılan nüfusumuzda 31 milyon 491 bin kişi olmuş. Yani çalışma çağındaki nüfusumuz ortadan ikiye bölünmüş. Yarısı işgücü piyasasının dışında yarısı da içinde. Böyle bir durumla daha önceki krizlerde hiç karşılaşmamıştık",mostly false
کشور ژاپن با ۱۲۰ میلیون جمعیت، فقط ۳۰۰ هزار کارمند دولتی دارد.,false
"Jens Spahn habe Anwälten 2,5 Millionen Euro gezahlt, um Wallraff-Doku zu verhindern.",false
Almanya’da bir Japon kafesinde Atatürk’e özel köşe yapıldığı iddiası,mostly false
"15 ile 64 yaş arası Türkiye’de hayatında 1 kere uyuşturucu denemiş kişilerin oranı yüzde 2,7",true
Syrer dürfen ihre Zweitfrauen nachholen,mostly false
"Çay alımlarına toplam 4,6 milyar lira ödedik.",true
Almanya’da huzurevinden kaçan iki kişinin heavy metal konserine katıldığı iddiası,mostly false
Pharma-Milliardär wegen Verschwörung und Drogenkartell verhaftet.,mostly true
1995 seçimlerinden 2011 seçimlerine kadar baktığımızda hükümet kurma görevinin yemin töreninden sonraki 3 gün içinde belirlendiğini biliyoruz.,true
Erzurum en fakir 3 ilden bir tanesi.,mostly true
Die mutmaßlichen Vergewaltiger auf Mallorca seien keine Deutschen sondern Türken,false
Acht von zehn Flüchtlingen kommen ohne Pass!,mostly false
Coronavirus befällt ersten Hund,mostly true
مصائب ونتیلاتور؛ از عوارض قلبی و مرگ و میر تا از دست رفتن ماهیچه‌ها.,mostly false
"Resmi olmayan rakamlara göre işsiz sayısı 5,5 milyona dayandı.",true
Kart şifresini tersten girince ATM'nin polis çağırdığı iddiası,false
"Die Seite „jungefreiheit.de” schreibt, Mohammed sei der beliebteste Jungenvorname 2017 in Bremen.",mostly true
"Geçen yılı 12,3 milyar dolarlık uluslararası yatırımla kapattık. Bu yılın ilk dört ayında 3,6 milyar ile geçen yılın üzerine çıktık. Amerika ve Avrupa ile birlikte Körfez ve Uzak Doğu Asya ülkelerinin payının da giderek yükseldiğini görüyoruz.",mostly false
"Gelişmekte olan ülkeler son beş yıllık dönemde ortalama yüzde 4,5'lik bir büyüme oranı elde ederken, Türkiye yüzde 3 oranında büyümüştür. 2008'de kişi başına düşen milli gelir 10.500 dolar iken, milli gelir 8.500 dolara düşmüştür.",mostly false
"Die Seite „jungefreiheit.de” schreibt, Mohammed sei der beliebteste Jungenvorname 2017 in Bremen.",mostly true
İstanbul Borsası'nın yüzde 60'ı yabancı sermayenin elinde,true
20 Asylwerber traten in Hungerstreik: Sie fordern 2.000 Euro netto Taschengeld,mostly true
Asylbewerber wurden während der Corona-Maßnahmen heimlich nach Görlitz gebracht,mostly false
کل بودجه فرهنگی کشور زیر نیم درصد است.,false
"(AK Parti iktidarı döneminde) …tarım sektörünün istihdama katkısı da yüzde 34,9'dan yüzde 20,4'lere kadar gerilemiştir.",true
دوربین‌های مداربسته خیابان‌ها قابلیت شناسایی سیم کارت‌های خاموش، کارت ملی هوشمند و پاسپورت را دارند.,false
"(Çanakkale’deki 4 adet) Mevcut termik santrale, yakın zamanda 15 termik kömür santralinin eklenmesi planlanıyor. 16 bin 828 MW kurulu güce sahip olacak 19 santralin sadece 504 MW kapasiteli olan 3'ü yerli kömür kullanacak.",mostly true
"TSK NATO’nun 2. büyük ordusu, dünyanın 5. büyük ordusudur",mostly false
"580 Meter lange Strasse in Hamburg für Diesel gesperrt, Ausweichroute 3,4 Kilometer lang",mostly true
Fotoğrafın İstanbul Okmeydanı’ndaki taşın eski ve yeni halini gösterdiği iddiası,true
Türkiye OECD ülkeleri arasında işsizlik oranını en hızlı azaltan ülke olmuştur,mostly false
"Türkiye, OECD ülkeleri arasında kadınların iş gücüne katılım oranının en düşük olduğu ülke.",true
Iraklı din adamının Iraklı bir Atatürk'e ihtiyacımız var dediği iddiası,true
2002 yılına kadar savunma sanayinin yüzde 80’i ithalatla karşılanıyordu.,mostly true
"Meine Wohnung, meine 11 Kinder, meine 5239 Euro Stütze!",mostly false
Tibet'e gökten ejderha düştüğü iddiası gerçek değil,false
"2016'da açılan işyerinin, toplama (işyerine) oranı yüzde 14,1; kapanan işyerinin ise yüzde 5,2 oldu.",mostly true
"Türkiye’de 2006’da bir kanun çıkardılar, dediler ki milli gelirin yüzde birini tarıma vereceğiz. 30 milyar dolar verecekken 12 milyar dolar verdiler. Bu devlet bu çiftçiye borçludur.",mostly true
Vermisst! Bitte teilt das weiter,mostly true
Covid-19 aşısı ve tedavisine ilişkin iddialar,false
Türkisches Staatsfernsehen über Adrenochrom,mostly false
15 yılda hiçbir öğrenci başladığı sistemle ve müfredatla mezun olamadı.,true
