claim,label,source_language
"Avrupa'da % 27 olan dolaylı vergi oranı Türkiye'de % 69 ile rekor seviyeye ulaştı.Yani Türkiye'de dolaylı vergiler Avrupa Birliğinin 2,5 katı.",mostly true,tr
طبق آمار رسمی، ازدواج‌‌های زیر ۱۸ سال جزو ازدواج‌های پایدار محسوب می‌شوند.,false,fa
"Unter der Überschrift „Deutsche Linke empört: Israel gewinnt ESC” schreibt der Autor Ramiro Fulano in seinem Satire-Artikel über vermeintliche Kritik von Medien, Gewerkschaften, SPD, Grünen und Linken an dem israelischen Sieg beim Eurovision Songcontest (ESC).",mostly true,de
"Greta Thunberg droht, Facebook zu verlassen, wenn ihre Kritiker nicht zum Schweigen gebracht werden",false,de
Halal-Schlachtung im Multikultiviertel. Polizei stürmt Wohnung.,mostly true,de
"„Es ist gut so, dass wir Deutsche bald in der Minderheit sind“.",false,de
Das ist der Kuchen mit dem die Linken Demokraten in New York ihren Sieg über das neue Abtreibungsgesetz gefeiert haben.,false,de
İspanya'daki Kim Milyoner Olmak İster? programında sorulan soru iddiası,false,tr
İskandinav ülkelerinde insanları güvenilir bulanların Türkiye’den çok daha fazla olduğu iddiası,false,tr
"2015 yılında gerçekleşen yüzde 4'lük büyüme hızı Hindistan (yüzde 7,3), Çin (yüzde 6,8), Filipinler (yüzde 6,0), Pakistan (yüzde 4,2), Malezya (yüzde 4,7), Endonezya’dan (yüzde 4,7) sonra en yüksek büyüme hızıdır.",false,tr
CO2-Wert unter Maske steigt auf ungesunde Konzentration,false,de
"2016 yılının ilk 5 aylık döneminde, 2015'in aynı dönemine göre ülkemize gelen yabancı ziyaretçi sayısındaki azalma 2,5 milyon kişi oldu. Bir başka deyişle yabancı turist sayısında yüzde 23 azalma yaşandı.",true,tr
Türkiye’de özelleştirmelerin başladığı 1986'dan 2015'e dek 65 milyar dolarlık satış yapılmış. Bunun yüzde 87’sini oluşturan 57 milyar doları AKP döneminde yapılmıştır.,true,tr
تمام شاخص‌ها به ما می‌گوید که وضع امروز از سال گذشته به مراتب بهتر است و آرامش مردم و ثبات بازار بیشتر است.,false,fa
Bu rakamlarla dünyada en yüksek enflasyona sahip 10. ekonomi olduk.,true,tr
"Gazeteci Bülent Mumay, referandumla ilgili Türkçe manşet atan Blick'e transfer oldu iddiası",false,tr
Hollanda’daki yoksul sayısı ve yoksulluk oranındaki değişime dair iddialar,false,tr
Asylanten bekomm eine warme Unterkunft gestellt. Nur der deutsche Obdachlose muss draußen bei 13 Grad minus schlafen.,false,de
"2003’te hanehalkı borcunun gelire oranı yüzde 5,1 iken, bu oran 2014’ün ilk 6 ayında yüzde 54 oldu.",true,tr
Ambulanslar İzmir-İstanbul Otoyolu’na ücret ödemeden giremediği için bir kişinin hayatını kaybettiği iddiası,false,tr
Dünyada 100 marka arasında bir tane Türk markası yok.,true,tr
Harita Çin’de koronavirüs sebebiyle 50 bin kişi yakıldığını göstermiyor,false,tr
10’ar yıllık dönemlerine böldüğümüzde işsizlikte en kötü 10 yılı yaşıyoruz. Sadece üniversite mezunu işsiz sayımız BM’de tanınan sayıya göre 70 ülkenin nüfusundan daha fazla.,mostly true,tr
„2017 gab es 95.000 Gewalttaten durch Flüchtlinge“,false,de
Das Patent für einen Covid-19-Test wurde bereits im Jahr 2015 von Rothschild angemeldet.,false,de
Danimarka’da elektrik enerjisinin yüzde 40’ının dalgalardan sağlandığı iddiası,false,tr
Der psychisch Kranke Straftäter Otto K. ist auf der Flucht,false,de
Virüs taşıyan On est tous Paris başlıklı e-posta iddiası,false,tr
"Rote Wetterkarte 2019, grüne Wetterkarte 2009: Die Tagesschau manipuliert.",false,de
"18 yıl önce, sahra altı Afrika ülkeleri ile dış ticaret hacmimiz 580 milyon dolar gibi oldukça düşük bir seviyedeydi. 2015’te ise, 6 milyar dolar seviyesine yaklaştı.",true,tr
Merkel schüttelt Macron die Hand,false,de
Zitate von Politikern der Grünen Partei,false,de
(İşsizlik Sigortası Fonunda) 31 Temmuz 2016 tarihi itibarıyla birikmiş olan para ne kadar? 98.3 milyar lira. Bu paranın sadece 11 milyar lirası yani yüzde 12'si gibi bir oran bu İşsizlik Fonu'nun kuruluş amacına ve felsefesine uygun olarak harcanmıştır.,true,tr
Fotoğrafların Uygur Türklerine yönelik katliam ve işkenceleri gösterdiği iddiası,false,tr
Dieter Bohlen trauert um seinen Sohn.,false,de
آمریکا به‌رغم اینکه بزرگترین اقتصاد جهانی است، بحرانی‌ترین اقتصاد را دارد.,false,fa
İşsizlik geldi yüzde 12’ye dayandı. Hiçbir kriz döneminde bu kadar yüksek işsizlik olmamıştı.,false,tr
دوربین‌های مداربسته خیابان‌ها قابلیت شناسایی سیم کارت‌های خاموش، کارت ملی هوشمند و پاسپورت را دارند.,false,fa
Türkiye toplam hasta sayısına göre ölüm oranı bakımından da Avrupa’daki en iyi ülke konumundadır,false,tr
Soruların bekçi alımı için yapılan sınavda sorulduğu iddiası,true,tr
Wassertrinken und Gurgeln hilft gegen das Coronavirus,false,de
"Üniversitelerde görev yapan kadın öğretim üyesi oranı Türkiye’de yüzde 29,5, Avrupa Birliği’nde yüzde 15 civarında.",false,tr
700 Euro Weihnachtsgeld für Flüchtlinge.,false,de
Koronavirüsün ortaya çıkışı hakkında iddialar içeren tweet zinciri,false,tr
"Dünya ekonomisinin %85’ini oluşturan G-20 1. çeyrekte %0,7, Türkiye ise %2,3 büyüdü.",false,tr
Michael Schumacher im Koma.,false,de
Fotoğraflar Türkiye'de organları çalınan Suriyeli çocukları göstermiyor,false,tr
"Vier Beispiele, warum Impfungen gefährlich sind",false,de
"Meine Wohnung, meine 11 Kinder, meine 5239 Euro Stütze!",false,de
Noel Babalı videonun Ankara Gölbaşı'nda çekildiği iddiası,false,tr
„EU will künftig Privatvermögen bei falscher Meinung beschlagnahmen!“,false,de
(2014 ilk çeyrek için açıklanan milli gelir hakkında) Yüzde 7 reel olarak dolar bazında düştü.,false,tr
Sağlık Bakanlığı gizli ibaresiyle dolaşıma sokulan metni yayınlamadı,false,tr
Palandöken'de yapımı süren nikah sarayının 22 milyon TL maliyeti olduğu iddiası,true,tr
12 yaşındaki her çocuğun kolesterol ilacı alması tavsiye edilmiyor,false,tr
Migranten in Mannheim halten Abstandsregeln bei Transport nicht ein,mostly true,de
Bei einem Ausbruch des Ätna wird mehr CO2 ausgestoßen als der Mensch jemals produziert hat,false,de
"15 ile 64 yaş arası Türkiye’de hayatında 1 kere uyuşturucu denemiş kişilerin oranı yüzde 2,7",true,tr
Peru'da 2 bin yıllık kedi figürü keşfedildiği iddiası,true,tr
Studie belegt Korrelation zwischen 5G und Coronavirus,false,de
"''2002 yılında baktığımız zaman, atık suların ancak ve ancak yüzde 30'u arıtılıyor... (ben) aşağı yukarı bu oranı yüzde 75-80'e çıkardım yani toplanan, arıtılan atık sular.''",false,tr
Sulak alanlar azalıyor diye yazıyorsunuz bu doğru değil. Biz 9 milyon hektar olarak aldığımız alanı 30 milyona çıkardık. 3 kat arttırdık. Tabiat parkları 10 misli arttı. Milli parklar da sayısı arttı.,false,tr
"Cumhurbaşkanlığı bütçesindeki 'Menkul Malların Büyük Onarım Gideri' başlıklı kaleme 2017 ve 2018 için 3'er milyon lira, 2019 yılında 100 milyon, 2020'de 140 milyon lira ayrıldığı görülmektedir",true,tr
"Biz geldiğimizde ortalama eğitim süresi 7 yıldı, şimdi 14 yıl.",false,tr
Türkiye bugün dünyanın en büyük havalimanını İstanbul'a yapıyor. 150 milyon yolcu kapasiteli havalimanı yapıyoruz.,false,tr
بر اساس آمارهای بین‌المللی، ایران در تمام رشته‌های صنعتی جزو بیست کشور اول دنیا است.,false,fa
"Makroekonomik göstergelerin hemen hemen hepsinde kur ataklarını yaşadığımız ağustos ayı öncesine, o sürece ve o döneme geldik.",false,tr
"Covid-19 ist keine gefährliche Krankheit, sondern eine Laborpandemie",false,de
ZDF: Für heute um 16 Uhr geplanter Artikel zur Corona-Demo wurde schon gestern frei geschaltet,false,de
Çamlıca Tepesi'ndeki tahribat iddiası ve karşılaştırmalı fotoğrafları,false,tr
"Almanya Türkiye'nin bir numaralı ticari ortağı, Hollanda da Türkiye'de en büyük doğrudan yatırım yapan ülke konumundadır.",true,tr
"Türkiye’de meslek liselerinin oranı yüzde 44, imam hatip okullarının oranı ise yüzde 13-14 düzeyinde.",false,tr
۲۷ درصد هیأت علمی دانشگاه‌ها را زنان تشکیل می‌دهند.,true,fa
Videonun Afrin harekatı sırasında atılan roketleri gösterdiği iddiası,false,tr
Angebliches Nasa-Satellitenfoto von Bränden in Australien,false,de
"6 milyon genç işsiz var. Brezilya'da yüzde 7,5, Endonezya'da yüzde 6,1, Meksika'da yüzde 3,9, ABD'de yüzde 5, Almanya'da yüzde 4,5, Güney Kore'de yüzde 3,5, Türkiye'de yüzde 10,3 oranında işsizlik görülüyor.",false,tr
محبوبیت حسن روحانی به ۷-۸ درصد رسیده است.,false,fa
"2014 yılında dünyanın 23 büyük ekonomisi içerisinde (ahbap-çavuş ekonomisi) kapsamında 14. sırada olan Türkiye, 2016’da 8. sıraya çıktı.",true,tr
"Resmi olmayan rakamlara göre işsiz sayısı 5,5 milyona dayandı.",true,tr
"WHO und IWF haben Lukaschenko Geld geboten, um in seinem Land einen Lockdown umzusetzen",false,de
"Diyarbakır’da hava trafiği son 10 yıl içerisinde 10 kat arttı. Taşınan insan sayısı 200 binin altındayken, şu an 2 milyonun üzerine çıktı.",false,tr
Menschen grillen auf dem Westfriedhof in Magdeburg,false,de
Koskoca İngiliz Kraliyeti 126 milyon lirayla idare ediliyor. Bizim Cumhurbaşkanının yanında Kraliçe Elizabeth fakir kalıyor.,false,tr
"Türkiye’de 2006’da bir kanun çıkardılar, dediler ki milli gelirin yüzde birini tarıma vereceğiz. 30 milyar dolar verecekken 12 milyar dolar verdiler. Bu devlet bu çiftçiye borçludur.",mostly true,tr
"Türkiye’de 1992’den beri 1000-1200 işçinin hayatını kaybettiğini her yıl görüyoruz. Şu dönemde yüksek, bu dönemde düşük dememiz bir şey ifade etmiyor",true,tr
در این دولت برای اولین بار در برداشت گاز از پارس جنوبی از قطری‌ها پیشی گرفته‌ایم.,true,fa
طبق نظرسنجی سایت رتبه‌بندی داوران فدراسیون جهانی فوتبال (فیفا)، علیرضا فغانی داور ایرانی در صدر داوران جام جهانی ۲۰۱۸ قرار دارد,false,fa
Erfurt: 56-Jährige Deutsche niedergeknüppelt und brutal vergewaltigt - Iraker entgeht Haftstrafe,false,de
Ceviz ağacı ve zehirli etkileri hakkındaki şehir efsanesi,false,tr
90 Beagle müssen eingeschläfert werden,false,de
Fotoğrafın İstanbul Okmeydanı’ndaki taşın eski ve yeni halini gösterdiği iddiası,true,tr
"Doktora seviyesinde -ki bu AR-GE merkezleri için en önemli kaynak kişileri oluşturur- mezuniyetler arasında, 39 ülke arasında 35'inci sıradayız maalesef.",mostly true,tr
"Die Seite „politikstube.com” suggeriert, dass die Stadt Rottweil besonders teuer ausgestattete Wohnungen für Flüchtlinge baut.",mostly true,de
"2002 yılında 20,8 milyon hektar olan orman varlığımızı, yaptığımız çalışmalarla 21,7 milyon hektara çıkardık.",true,tr
Foto zeigt: Angela Merkel und Ursula von der Leyen halten keinen Abstand,false,de
"Cari açık, tarihi şekilde iyileşmeye devam ediyor.",false,tr
Türkiye tarımda net ihracatçı bir ülke konumuna geldi.,false,tr
Gülse Birsel’e atfedilen sözler bir Karadeniz fıkrasından alınma,false,tr
Almanya’da huzurevinden kaçan iki kişinin heavy metal konserine katıldığı iddiası,false,tr
"G20’nin kalkınma hedefi yüzde 2, Türkiye ise ortalama yüzde 5 büyüyor",mostly true,tr
Die Grundrente liege 10 Prozent über dem Hartz-4-Satz. Das seien 46 Euro.,false,de
Dank Familiennachzug: Syrer holt 31 Verwandte nach – bisher aufgelaufene Kosten 700.000 Euro,false,de
Angeblicher Tweet von syrischem Flüchtling Dawuhd Nabil,false,de
Ein Buch mit vulgären Begriffen für Sex wird in deutschen Schulen benutzt.,false,de
"Mann aus dem Niger schneidet Baby Kopf ab, Polizeisprecher Timo Zill verharmlost: “Täter wirkte auf Frau ein“.",false,de
Şilili reklamcı Ferrada'nın Hayır kampanyası hakkında söylediği iddia edilen sözler,false,tr
Ohne die Grünen bleibt die Heimat grüner!,false,de
Takvim'in Büyükada'da yapıldığını iddia ettiği toplantının görseli New Orleans'tan,false,tr
2002’de 242 milyar lira olan kamu ve özel sektör toplam yatırım miktarını 2017'de 929 milyar liraya çıkarttık.,false,tr
"İstihdam yaratma potansiyelimiz 90'lar seviyesinde olsaydı, bugün işsisizlik yüzde 14 seviyesine çıkar ve işsiz sayımız 3,5 milyon kişi daha fazla olurdu.",false,tr
(Avrupa’da) genç işsizliği bazı ülkelerde %50’yi buldu.,false,tr
ثروت ۲۶ نفر معادل ثروت نیمی از مردم جهان است.,true,fa
Yavuz Sultan Selim Üniversitesi'nde yazılan doktora tezi için Suriyeli bir kişinin verdigi demeçle ilgili iddia,false,tr
Çankırı’nın dışında tüm illerde hava kirliliği PM 10 değerini aşıyor.,mostly true,tr
Mord an Daniel H. war geplant - Zeitung wusste schon 2 Tage vorher Bescheid,false,de
77’den bu yana 41 yıl sonra 30 barajını geçmişiz.,true,tr
Batman'da bir vatandaşın ikametgah adresine Suriyelilerin kaydedildiği iddiası,true,tr
"Gibt man bei Google Maps die Koordinaten 52.376552, 5.198303 ein, sieht man zwei Männer die versuchen eine Leiche in einen See zu werfen",false,de
Flüchtling mit Schild auf dem steht: „Ich habe meinen 2 jährigen Sohn seit vier Jahren nicht gesehen“,false,de
Videonun Afrin'deki operasyondan sıcak görüntüleri gösterdiği iddiası,false,tr
Yozgat Sorgun'da araç içinde oy kullanıldığı iddiası,true,tr
Devletin ihalesiz alımı % 71 yükseldi,true,tr
عمل سزارین در کشورهای دیگر منسوخ شده است.,false,fa
"Zwei Drittel der 1,1 Milliarden Menschen in Subahara-Afrika sind auswanderungswillig.",false,de
Cannabis heilt alle Arten von Krebs.,false,de
"HDP, Türkiye’nin en yoksul mahallelerinden, İstanbul’un en fukara semtlerinden oy almıştır.",true,tr
94 Prozent der Corona-Toten sind nicht daran gestorben,false,de
Fotoğrafın Suriye'de vurulan Türk tankını gösterdiği iddiası,false,tr
"Eine Frau soll in Chemnitz von mehreren Männern belästigt worden sein. Zwei ihr zu Hilfe eilende Männer wurden mit Messern schwerst verletzt. Es wird berichtet, dass nun auch der zweite seinen schweren Verletzungen erlegen ist.",false,de
"(2002 – 2012 enerji kaynak kullanımı) doğal gaz kullanımı yüzde 17 iken yüzde 32 seviyelerine çıkmış,  petrol kullanımı yüzde 41 iken yüzde 26 seviyesine düşmüş, ""yenilenebilir enerji"" kaynakları yüzde 0,3’ten yüzde 4’e çıkmıştır.",mostly true,tr
2003-2006 döneminde yolsuzlukla etkin mücadele amacıyla bu alanda önemli 7 adet uluslararası sözleşmeye taraf olunmuştur.,false,tr
"Henriette Reker sagt es gäbe weniger Vergewaltigungen, wenn Frauen zuhause bleiben würde",false,de
(به نقل از ملیندا گیتس) سریع‌ترین کاهش نرخ فرزندآوری در تاریخ جهان در ایران اتفاق افتاده است.,false,fa
„Die Simpsons“ haben den Brand der Notre-Dame vorhergesehen,false,de
"5 yıllık 10. Kalkınma Planı’nda hedef ne oldu, gerçekleşme ne oldu, sapmalar ne oldu? (…) Beyefendi senin hiçbir hedefin tutmadı.",true,tr
Masken sind gesundheitsschädlich und bringen nichts,false,de
İranlı çiftin sosyal medya paylaşımları nedeniyle hapis cezasına çarptırıldığı iddiası,true,tr
در ایران به ازای هر ۱۰ هزار نفر بین ۱۱ تا ۱۶ پزشک مشغول فعالیت‌اند و از این نظر ایران وضعیتی بدتر از سوریه، قرقیزستان و مغولستان دارد.,true,fa
Akeroğlu'nun üzerine çıktığı heykel Louvre'da değil,false,tr
13 Ağustos’ta koalisyon sürecinin sıkıntıya girdiği andan itibaren dolar Türk lirası karşısında yüzde 22 değer kazandı.,false,tr
Sozialminister Manne Luche fordert Impfung mit giftigem Formaldehyd,false,de
"In Griechenland rücken Bauern aus, um ihr Land vor Migranten zu verteidigen",false,de
Nihat Zeybekci'nin TBMM'nin sitesindeki özgeçmişinden İngiltere eğitimi kaldırıldı iddiası,true,tr
"AKP iktidarda olduğu 15 yılda toplam yağlı tohum ve türevleri ithalatını 2 milyon tondan 6,5 milyon tona yükseltmiştir. Yağlı tohumlarda tamamen dışa bağımlı olan Türkiye, üretimini artırmak zorundadır.",true,tr
Millionen Türken sind kostenlos krankenversichert.,false,de
Der perfide Plan des World Economic Forum,false,de
CLAIM: The Facebook lives from ISS broadcasted by UNILAD and Viral USA are fake.,true,tr
گفت‌و‌گوی ضبط شده دو خبرنگار آمریکایی در کاخ سفید درباره «سرکاری بودن کرونا» و اینکه «واکسن کووید۱۹ زده‌اند»,false,fa
Mecliste açık ara en çok kadın milletvekili olan partiyiz,false,tr
"2017 yılında dünyada 1 milyar 322 milyon kişi seyahat etti, Türkiye 2017'de en çok turist çeken ülkeler sıralamasında 6. sırada yer alıyor.",false,tr
آیت‌الله احمد جنتی با در دست داشتن لیست انتخاباتی اصول‌گرایان هنگام رای‌گیری مرتکب تخلف نشده است.,false,fa
ARD und ZDF haben nicht über Mord mit Schwert in Stuttgart berichtet,false,de
"ABD ve AB ülkeleri başta olmak üzere, birçok ülkede milli gelirin %10’unun üzerinde teşvik ve yardımlar açıklanmışken, Türkiye’de büyük bölümü vergi ertelemesi ve dolaylı desteklerden oluşan 100 milyar TL’lik ekonomik paketin milli gelire oranı sadece %2 düzeyindedir",mostly true,tr
on dört yıldır 6 kez vergi affı çıkarıldı.,true,tr
Syrischer Muslim mit 4 Frauen und 23 Kindern erhält monatlich 30.000 Euro Sozialhilfe.,false,de
"Diyarbakır’a 12 yılda, 16 milyar lira yatırım yaptık",false,tr
دولت سالانه ۲۰ برابر یک دانش‌آموز برای هر زندانی هزینه می‌کند.,false,fa
Son 10 yılda 7 milyon 303 bin istihdam artışı sağlandı. Bunun 3 milyon 226 binini kadınlar oluşturdu. Bu istihdam artışı ve iş gücü artışıyla da OECD ve AB ülkeleri arasında lider konuma gelmişiz.,false,tr
"Türkiye'de kadın istihdam oranı yüzde 26 civarındadır, aynı oran gelişmiş ülkelerde yüzde 60'ın üstündedir",true,tr
Foto von schreiendem Affen mit Jungem soll angeblich aus Amazonas-Gebiet stammen,false,de
"İki yıl içerisinde elektriğe %71, doğalgaza %62 zam yaptınız. EPDK Kasım 2018 verilerine göre faturasını ödeyemediği için 14,5 milyon insanın elektriği kesildi. Yine EPDK verilerine göre 2014-2018 tarihleri arasında faturasını ödeyemediği için 5,4 milyon ailenin doğalgazı kesildi.",true,tr
''Türkiye'nin küresel anlamda rekabet edebilen bir tek markası yoktur.'',true,tr
"Biz burada 38 yasa çıkardık. Cumhurbaşkanı 41 Cumhurbaşkanlığı kararnamesi çıkardı. Toplam sayı olarak, yasaların toplam maddesi 669, Cumhurbaşkanının kararname madde sayısı 1.915 yani 3 misli daha fazla yasama çalışması yapılmış oldu sarayda.",true,tr
اکنون این مساله موسسات مالی غیرمجاز تمام شده و ما موسسه اعتباری غیرمجاز نداریم,false,fa
Starbucks'ın Suudi Arabistan'da farklı logo kullandığı iddiası,false,tr
Bayern zahlt keine Sofort-Hilfe für Unternehmen bis 10 Mitarbeiter – Enttäuschung für viele Unternehmen,false,de
Türkiye DEAŞ'ı 2013'te terör örgütü olarak gören ve kabul eden ilk ülkedir.,false,tr
Angebliche Fotos von der griechisch-türkischen Grenze,false,de
KKTC’deki kişi başına milli gelirin aşağı yukarı eskiden 10 da biri iken bugün yarı nispetine ulaşması da gerçekten dikkate alınması gereken bir faktördür.,mostly true,tr
İnsan DNA’sında dünya dışı yaşam izleri saptandığı iddiası,false,tr
Biz bunu (kişi başına düşen milli gelir) 3 bin 400 dolardan aldık 11 bin dolara çıkardık.,false,tr
NASA pahalı uzay kalemleri geliştirirken Sovyetler Birliği kurşun kalem mi kullanıyordu?,false,tr
"„Muslima: Wir fordern mehr Schweinefleischfreie Menüs, oder wir werden Deutschland wieder verlassen“",false,de
Zerstörung des Corona-Hypes,false,de
"580 Meter lange Strasse in Hamburg für Diesel gesperrt, Ausweichroute 3,4 Kilometer lang",mostly true,de
"Prügelattacken auf Deutsche in Neuruppin, Rheinsberg und Lindow",false,de
Videonun Pakistan'da 'İslam'da haramdır' diye ağaç söküldüğünü gösterdiği iddiası,false,tr
Üniversiteyi bitiren her dört gençten biri işsiz,true,tr
"Bu yeni yapı, 15 Temmuz'dan sonra önündeki bütün engelleri kaldırdı, sendikaları darmadağın etti, sadece kendisine yakın sendikalar büyüdü. Memur-Sen'in üye sayısı 13 kat arttı.",false,tr
فیلم مراسم عروسی زینب سلیمانی,false,fa
Türkiye ekonomisi tüm başlıklarda gelişmiş ülkelerden dahi çok ileri seviyededir. Dünyada bir numara.,false,tr
RTÜK'ten Nakşibendilik Sempozyumu'na kamu spotu izni,true,tr
"Her sene 1,6-1,7 milyon Z kuşağından yeni seçmen devreye giriyor",false,tr
Seehofer will ganze Terror-Sippen nach Deutschland importieren.,false,de
Flüchtlinge treten Kleinkind zusammen,false,de
"1946-2002, kırk üç yılda ortalama büyüme yüzde 5,1... Peki, 2003-2014 ortalama büyüme yüzde 4,7",false,tr
WHO ändert ihre Meinung: Schutzmasken können Risiko einer Corona-Ansteckung erhöhen,false,de
Bugün Amerika’da bile hızlı tren yok. İngiltere'de yok ama Türkiye’de hızlı tren hayali hükümetimiz döneminde gerçeğe dönüştü.,false,tr
Ölen sahibinin fotoğrafını telefonda gören kedi videosu,false,tr
به گفته روزنامه سان طبق دستورالعمل جدید در آمریکا، افراد دارای سندروم داون، فلج مغزی یا اوتیسم در صورت ابتلا به کرونا به حال خود رها می‌شوند تا بمیرند,false,fa
"(OECD raporunda) Türkiye'de rüşvet, yolsuzluk ve kara para aklamadan söz ediyor...İlk kez Türkiye bu kadar net bir uluslararası raporda yolsuzluk konusunda yer alıyor.",true,tr
Chef Deutscher Kriminalbeamter muss gehen – zuvor hatte er Seehofers Kriminalstatistik in Frage gestellt.,false,de
Ulaştırma Bakanı Turhan'ın İstanbul Havalimanı için ‘kötü yere yaptık’ itirafı iddiası,false,tr
"Von der Leyen tritt zurück, bekommt Beratervertrag",false,de
Enerjide yüzde 50’nin üzerinde Rusya’ya bağlıyız. Dünyada böyle başka bir devlet yok.,false,tr
Tunç Soyer’in İzmir’e özerklik hazırlığı için bayrak ve para çalışması yaptırdığı iddiası,false,tr
اعتبار علمی و سوابق مهران توکلی کشه و ادعاهایش درباره درمان کرونا با «آب گنس»,false,fa
Jens Spahn habe in einem Tweet die Tat in Frankfurt relativiert,false,de
Olimpos'un imara açıldığı iddiası,false,tr
Sözlerin Steve Jobs'ın ölmeden önce yazdığı son yazıdan olduğu iddiası,false,tr
İzmir'deki raylı sistemlere 30 bin TL ayrıldığı iddiası,true,tr
Trump’ın “Türkiye’deki darbe girişimine CIA yardım etti” dediği iddiası gerçek değil,false,tr
2007-2018 yılları arasında genç istihdamını en fazla artıran ülke olduk Avrupa Birliği'nde.,false,tr
Durch Flüchtlinge eingeschleppt – Seuchenalarm durch Krätze-Epidemie in Querfurt.,false,de
Krebspatienten sterben mit Chemotherapie schneller als ohne Behandlung,false,de
Schweizerisches Labor: Skripal-Gift stammt aus NATO-Arsenal,false,de
Wegen Coronavirus: in Hongkong zerstören die Menschen die 5G Masten,false,de
Mevsimsellikten arındırılmış işsizlik oranı Haziran’da yüzde 10.9 ile son 70 ayın zirvesine çıktı.,true,tr
Videonun Hırvatistan milli takımını destekleyen taraftarları gösterdiği iddiası,false,tr
2002 yılında hızlı bant internet kullanan kişi sayısı 20 bindi. Biz birçok Afrika ülkesinden daha kötü durumdaydık. Bugün ki kullanıcı sayımız 40 milyona dayandı.,false,tr
Suudi Arabistan'da şişme havuz reklamındakilerin sansürlendiği iddiası,true,tr
Türkiye sadece büyümüyor aynı zamanda bu büyümeyle ortaya çıkan gelirin adil bir şekilde dağılmasını sağlıyor.,false,tr
تصویر بیلبوردی در شیکاگو حاوی توصیه‌های بهداشتی منسوب به پیامبر اسلام,true,fa
MHP'nin seçim otobüsünde Erdoğan'ın fotoğrafının yer aldığı iddiası,false,tr
Star TV'nin Etnospor Kültür Festivali için '16 ülkeden 10 sporcu katılıyor' şeklinde alt bant kullandığı iddiası,true,tr
Türkiye Maastricht ile Kopenhag kriterlerini gerçekleştirdi ve birçok AB ülkesinden de iyi konumda.,false,tr
Babil dizisine soruşturma açıldığı iddiası,false,tr
نصب پوستر درباره امام حسین بر اتوبوس‌های لندن به درخواست شهردار این شهر,false,fa
"Ağustos ayında TL %40 a yakın değer kaybetti, bu Türkiye dalgalı döviz kuruna geçtiği 2002 yılından beri en yüksek değer yitirişi",false,tr
2002-2014 yılları arasında Türkiye'nin ihracat hacmi 4.2 katına yükselmiştir.,true,tr
Das Rentenniveau in Deutschland sei viel niedriger als in Österreich oder im EU-Schnitt,mostly true,de
"Krizdeki Arjantin Peso’sundan sonra, en fazla değer kaybeden para birimine sahibiz.",true,tr
