claim,label,source_language
"Frankreich: Polizei und Medien verschweigen Mordfall über 2 Monate, Täter auf freiem Fuß",false,de
Elon Musk'ın Tesla araç fabrikasını anlatırken Gelibolu örneğini verdiği iddiası,true,tr
Christian Drosten entlarvend ehrlich,false,de
Der Amokfahrer von Bottrop und Essen ist Bosnier.,false,de
Videonun döyüşdən qaçan Azərbaycanlıları göstərdiyi iddiası,false,tr
Türkiye’de ilk aşı kampanyasının 1985’te yapıldığı iddiası,false,tr
هیچ یک از روسای قوه قضاییه تا کنون تحصیلات حقوقی نداشته‌اند.,true,fa
Italienisches Lied auf Youtube: Jeder Klick ist eine Spende an ein Krankenhaus in Bergamo,false,de
Fotoğrafın Erdoğan ve Soros'u aynı masada gösterdiği iddiası,true,tr
"Die Polizei in NRW soll eine Anordung haben, Verbrechen von Ausländern zu vertuschen.",false,de
سلمان رشدی در منچستر خودکشی کرد!,false,fa
Asgari ücret 8 Avrupa Birliği ülkesinden fazla...,true,tr
... üniversite mezunu işsizlerin oranının her geçen gün arttığı ve günümüzde neredeyse 3 üniversite mezunundan 1’inin işsiz dolaştığı ülkemizde,false,tr
Foto zeigt Wahlbetrug durch Briefwahl für Koma-Patienten im Krankenhaus,false,de
Vatandaşlarımızı doğrudan ilgilendiren gıda enflasyonu yüzde 16’ya dayanmıştır.,mostly true,tr
Geçmiş yıllarda kendi üretimi kendine yettiğinden canlı hayvan ve et ihracatı yapan Türkiye uygulanan yanlış politikalar nedeniyle hayvancılıkta ithalatçı konuma gelmiştir.,mostly true,tr
...Joe Biden 8 ay önce konuşmuş. Devletin ajansı 4 ay önce sadece İngilizce olarak haberini geçmiş…,false,tr
Tipps eines italienischen Arztes zum Coronavirus,false,de
"2002'de kişi başına dış borç bin 963 dolarken, bugün 5 bin 224 dolar oldu.",true,tr
Ein Flüchtling wollte eine Frau in Heilbronn vergewaltigen,false,de
"Geçen yıl aynı dönemde 1,8 milyar TL faiz dışı fazla varken, bu yıl faiz dışı bütçe açığı da 12,3 milyar TL’ ye ulaşarak yeni bir rekora imza atmıştır.",true,tr
Sebastian Kurz verbietet George Soros Operation in Österreich.,false,de
Keine Medienberichterstattung über Brände im Amazonasgebiet,false,de
Paralel Yapı’nın ihaneti sadece 17 ve 25 Aralık'la sınırlı değil. Moody’s ve Fitch'in iklim değiştirmeye yönelik açıklamalarında bu yapının parmağı var.,false,tr
840 lira emekli maaşı var. Türkiye'de en düşük ve en yüksek arasındaki fark 9 kat oldu. Finlandiya'da bu 2 kat.,false,tr
"Die SPD ist für HartzIV, Leiharbeit, Versteuerung der Rente, den größten Niedriglohn-Sektor Westeuropas, Steuergeschenke für Superreiche und Belastungen für Arbeiter verantwortlich.",false,de
Polizei und Sicherheitsbehörden rüsten sich für Bürgerkrieg in Deutschland,false,de
Cumhurbaşkanı Erdoğan’ın örtülü ödenekten 747 milyon lira harcadığı iddiası,false,tr
"Von PS - 18. Oktober 2018 7 3446 Share Immer dann, wenn man denkt, es sei nun wirklich nicht mehr möglich, den grünen Irrsinn noch weiter zu steigern, wird man eines Schlechteren belehrt. So sah sich nun der Eigentümerverband Haus & Grund gezwungen, seinen 900.000 Mitgliedern zu empfehlen, die Namensschilder bei vermieteten Wohnungen zu entfernen! Der Grund: Die Mieter könnten sich durch die Klingelschilder in ihrer Privatsphäre verletzt sehen und den Vermieter dann verklagen – Bußgelder bis zu 20 Millionen Euro (!!!) drohen. Basis dieser Klage: Die unsägliche DSGVO, also die sogenannte Datenschutz-Grundverordnung. Geistiger Vater dieses unsäglichen Ungetüms: Der „Grünen“-Europaabgeordnete Jan-Philipp Albrecht. Ein Wahnsinn. Seit jeher bringen Menschen ihren Namen am Klingelschild an, damit man sie erreichen kann. So gut wie keiner hat sich daran bislang gestört, und die wenigen, die sich daran wirklich störten (z.B. gefährdete Personen), haben das Namensschild einfach von selbst weggelassen. Und nun soll das alles möglicherweise widerrechtlich sein und mit enormen Bußgeldern bedroht werden? Das versteht wirklich kein Mensch mehr. Aber genau das ist grüne Ideologie. Übrigens mit freundlicher Unterstützung der Kanzlerdarstellerin: Merkel hätte es in der Hand gehabt, diese grüne DSGVO auf europäischer Ebene zu stoppen, aber das hat sie unterlassen, weil sie keinen Ärger mit den „Grünen“ haben wollte. Merkel steht nämlich mittlerweile, wie ihre gesamte entkernte CDU, für linksgrüne Politik. Die Wähler in Hessen mögen sich klar machen: Wer grün wählt, bekommt dann auch grüne Irrsinns-Politik. Heute wurde in einer Umfrage ein aktueller Wert von 22% für die „Grünen“ in Hessen bekanntgegeben – wahrlich erschreckend. Ich werde voraussichtlich im Rahmen meiner morgigen Kolumne darauf sowie auf die drohenden Folgen, die bislang noch gar nicht thematisiert werden, eingehen. Zeit, den grünen Irrsinn schnellstens zu beenden. Zeit, die einzige Partei zu wählen, die sich den gesunden Menschenverstand bewahrt hat. Zeit für die AfD. Folgt und kommentiert unsere Beiträge auch im neuen sozialen Netzwerk für die Mitte der Gesellschaft. Kehrt dem Verfolgungsbuch „Facebook“ den Rücken. Hier anmelden Neuste Älteste Beste Bewertung Bingo Mitglied Bingo Was für ein Quatsch ! Sollen die Grünlinge bitte anfangen, jeder bekommt „00“ und seine Initialien. 30 Petrus Mitglied Petrus Irrsinn, wahnsinn, dummheit… 30 obo Mitglied obo Als nächstes , wird jedem Neugeborenen die persönliche Nummer schon eintätowiert.Deutschland entwickelt sich immer mehr zu einem Irrenhaus.Blödheiten von sich zu geben scheint inzwischen zu den beliebtesten Spielen bei den etaplierten Politikern zu gehören.Zeit für Veränderung,Zeit die Partei zu wählen, die noch klar bei Verstand ist, AfD! 46 Carl Stephen Berg Mitglied Carl Stephen Berg Schilda war dagegen eine intelligente Hochkultur… 15 Fausti Mitglied Fausti Schlimmer geht’s immer. Da fragt man sich wie die Leute ihre Post, Einschreiben oder Pakete zugestellt bekommen. Die Post muss doch wissen, in welcher Etage jemand wohnt. Da wird dann scheinbar nur noch im Hausflur abgestellt. 12 Kai Mediator Mitglied Kai Mediator Anstatt grün zu wählen gäbe es eine Alternative: Strick kaufen und aufhängen. Man verpestet die Umwelt nicht mit CO2, verbraucht keine Ressourcen, muß an keiner Tiertötung mehr beteiligt sein und ganz wichtig: man stellt seine Wohnung einem Neubürger zur Verfügung. Wer nicht AFD wählt, hat einfach nichts begriffen. Da kann es gar keine zwei Meinungen geben. 21 Frauenrechte Mitglied Frauenrechte Das waren fake news. Bitte richtigstellen. 0 Zum Netzwerk POLITIKSTUBE AKTUELL Multikulti Meserattacke in Hannover: „Männergruppe“ sticht 18-Jährigen nieder – Not-OP video Nachrichten Rom: Gruppenvergewaltigung und Mord an 16-Jähriger – Linksfaschisten blockieren Salvinis Trauerbesuch Nachrichten Messerattacke in Berlin: Polizist niedergestochen – Not-OP video AfD Rede von Gottfried Curio in Frankfurt Multikulti Proteste in Bihać (Bosnien): „Migranten brechen in Häuser ein, halten Kindern... video Multikulti Libanesen-Clan aus Düsseldorf schlachtet Luxusautos aus – Schaden in Millionenhöhe",false,de
Wissenschaftler in Amsterdam zerstörten Brustkrebs-Tumore in 11 Tagen ohne Chemo!,false,de
"Ar-Ge harcamasının milli gelire oranı 2002’de yüzde 0,53 iken, 2014’te  yüzde 1 seviyesini aştı.",true,tr
"Yaklaşık 2,5 milyon işsiz, iş bulmaktan umudunu kesmiş. Dünyanın hiçbir yerinde umudunu yitirmiş böyle bir nüfus yok.",false,tr
شرکت‌های زیرمجموعه دفتر رهبری مالیات پرداخت می‌کنند.,false,fa
Videonun Japonya'da görevlilerin yolcuları metroya sığdırmaya çalıştığını gösterdiği iddiası,true,tr
Suudi Arabistan’da bazı ürünlerin üstüne 'Dokunmayın Türk ürünü' yazıldığı iddiası,true,tr
Bursa'da hava kirliliği Dünya Sağlık Örgütü limitlerinin 10 katı...,true,tr
Liegengebliebenes Elektroauto wird mit Dieselaggregat geladen,false,de
Videonun Kanada Başbakanı Trudeau'nun araç konvoyunu gösterdiği iddiası,false,tr
İkisinin de kapısına kilit vuruluyordu AK Parti geldiğinde. Şimdi o kapanacak şirketler(savunma sanayisinden) dünyanın en büyük 100 şirketi arasına girdi.,false,tr
"Şu anda dünyada üniversiteye erişim bakımından ikinci sıradayız, bu son 12 yılda oldu.",true,tr
CMK uyarınca Cumhurbaşkanı’na hakaret tutuklama nedenleri arasında değil,mostly true,tr
Salvador Dali için İstanbul’da lokma döküldüğü iddiası,true,tr
Videonun Suriye'deki bir stadyumda 'Çav Bella' şarkısını söyleyen taraftarları gösterdiği iddiası,true,tr
Vergleich der Todesopfer durch islamistischen und rechten Terror in Deutschland seit 1990,false,de
Dieses Foto zeige die Geretteten von der „Sea-Watch 3“,false,de
20 Asylwerber traten in Hungerstreik: Sie fordern 2.000 Euro netto Taschengeld,mostly true,de
"(30 Mart seçimleri)  büyükşehir belediye başkanlığı için kullanılan 1 milyon 527 bin 252 oy, belediye başkanlığı seçimleri için 1 milyon 840 bin 140 oy geçersiz sayılmıştır. Bu rakamlar oldukça fazladır.",false,tr
Rusya kaynaklı nükleer sızıntı ve radyoaktif bulutların Türkiye'den geçtiği iddiası,false,tr
"Kadınlarımızın iş gücüne katılım oranı 2002'de yüzde 27.9 iken, bu oranı 2014 yılında yüzde 33.6’ya yükselttik.",false,tr
Anayasa Uzlaşma Komisyonu’nun 21 aylık süresinde Meclis’te temsil edilen partilerin dördünün de anayasa taslağı olmadı,false,tr
13 yılda 135 milyar dolar yabancı yatırım Türkiye’ye geldi,false,tr
Drei unbekannte haben in Bad Hersfeld zwei Bundeswehrsoldaten beleidigt und angegriffen.,false,de
"Eine WHO-Regionaldirektorin soll gesagt haben, dass es keine zweite Corona-Welle gebe.",false,de
جمعیت فارسی‌زبانان دنیا امروز می‌توانست یک میلیارد نفر باشد.,false,fa
"Terörden olumsuz etkilenen 21 ilde bu yılın 10 ayında 11 bin 354 esnaf kapısına kilit vurdu, kapanan şirket sayısı 1.549'a ulaştı.",false,tr
Zwei Kinder werden vermisst.,mostly true,de
2002 yılından bu yana öğretmenlerin maaşlarındaki alım gücü yüzde 43 oranında düştü.,false,tr
Ekrem İmamoğlu'nun Beylikdüzü'ne Makarios'un heykelini diktiği iddiası,false,tr
Das Foto von Greta Thunberg im Zug sei ein Fake,false,de
Foto von Kreuzfahrtschiff in Venedig,false,de
Belediye seçimlerinden bu yana 1 milyon 25 bin oy arttırmışız.,true,tr
سقط جنین ۲۰ برابر تلفات سوانح رانندگی کشور است.,false,fa
792 seçmenin bulunduğu Lüksemburg’da 9 bin 729 oy kullanıldığı iddiası,false,tr
Video Yeni Zelanda'daki saldırıdan sonra Müslüman olan genci mi gösteriyor?,false,tr
Hurma ithalatının yüzde 51'inin İsrail'den yapıldığı iddiası,false,tr
"Österreich impft alle Kinder mit Nasenspray, das gentechnisch veränderte Organismen, Affen- und Hundezellen enthält",false,de
İstanbul'daki üçüncü havalimanından yurt dışına çıkanlardan 20 euro alınacağı iddiası,true,tr
رهبری در انتصاب‌هایش از همه گروه‌های سیاسی بهره می‌برد.,false,fa
Grippeimpfungen erhöhen das Risiko an Corona zu erkranken,false,de
İstanbul Havalimanı'nın şantiye alanını su bastığı iddiası,true,tr
İran Şahı Nasreddin'in haremine ait olduğu iddia edilen fotoğraflar,true,tr
Finlandiya başbakanının haftada 24 saat çalışılacağını açıkladığı iddiası,false,tr
Türkiye'de son 15 yılda hane halkının toplam borcu tam 75 kat artarak bugün 550 milyar TL'ye ulaşmıştır.,true,tr
Hollanda'da evden çalışanların sabit masraflarını işverenlerin karşıladığı iddiası,false,tr
"Nüfusumuzun yüzde 39,7'si sızdıran çatı, nemli duvar, çürümüş penceresi olan konutta oturmaktadır.",true,tr
"İstanbul, Türkiye'nin vergisinin yüzde 50'sini veriyor ama yüzde 10'unu bile almıyor.",mostly true,tr
"2003 yılının sonunda ... iş aramayan, 'Arasam bulamam' diyen fakat 'Tabii ki iş bulsam çalışacağım' diyenler, yani umutsuzlar 1 milyonun altındaydı, 946 bindi. Son Mayıs ayında... Umutsuzlar 2,5 milyona çıktı.",true,tr
"Foto von verletzter Frau, die angeblich von George Floyd geschlagen wurde",false,de
Eine „Mörderbande” und „islamistische Soldateska” haben eine Frau in Zittau ermordet.,false,de
"Yenilenebilir enerji kaynaklarından elektrik üretiminde, yüzde 31’lik artışla, Avrupa başta olmak üzere birçok ülkeyi geride bıraktık.",mostly true,tr
„Der Postillon“ verbreitet seriöse Nachrichten oder Fake News.,false,de
در همه دنیا برای پوشش دانشجویان در دانشگاه قوانینی بعضا سخت وجود دارد که دانشجویان در محیط دانشگاه ملزم به رعایت آن هستند.,false,fa
"Donald Trump: „„Wenn ich kandidieren würde, würde ich als Republikaner kandidieren. Sie sind die dümmste Gruppe von Wählern im Land. Sie glauben alles auf Fox News. Ich könnte lügen und sie würden es immer noch schlucken. Ich wette, meine Zahlen wären fantastisch.“",false,de
Türkiye'nin artık cari açık diye bir sorunu kalmamıştır.,false,tr
Täter von Volkmarsen ist muslimischer Marokkaner mit deutschem Pass,false,de
"Der Polizist, der in Leipzig verletzt wurde, sei gestorben",false,de
Belediyelerin kullandığı tapu sorgulama sistemine TKGM tarafından kısıtlama getirildiği iddiası,false,tr
"Almanya'da neredeyse güneş yok, neredeyse enerjisinin üçte birini güneş enerjisinden sağlıyor.",false,tr
برای همه دنیا روشن است ویروس کرونا یک سلاح بیولوژیک است که در آزمایشگاه ساخته شده است.,false,fa
Sexuelle Übergriffe durch Zuwanderer haben sich von 2014 bis 2018 versechsfacht,false,de
Einnahmen durch Pfandflaschen sollen künftig versteuert werden,false,de
"Avrupa Birliği ve OECD ülkeleri arasında hazırlanan rapora göre, Sosyal Adalet Endeksi’nde Türkiye, 41 ülke arasında 40. sırada",true,tr
Thomas Edison’un son nefesinin bir kapsülde saklandığı iddiası,false,tr
Görsellerin TAMAM ve DEVAM tweetlerinin yurtdışından atıldığını gösterdiği iddiası,false,tr
Fotoğrafın AK Parti milletvekili Radiye Sezer Katırcıoğlu'nun camide konuşma yaptığını gösterdiği iddiası,true,tr
Keskinoğlu ve virüslü yumurtalar iddiası,false,tr
188 ülke içinde bir yıllık enflasyonu bizim bir aylık enflasyonumuzun altında 153 ülke var.,true,tr
"Türkiye uluslararası alanda eğitimin kalitesi, eğitimde başarı oranları, eğitim sisteminin etkinliği ve verimliliği bakımından dünya sıralamasının alt basamaklarında yer alıyor.",false,tr
"Sendikanın olduğu işyerinde iş kazası oranı yüzde 8, sendikanın olmadığı yerde iş kazası oranı yüzde 92.",false,tr
In Deutschland sterben Menschen jetzt nur noch am Coronavirus,false,de
"Sadece Dolar/Euro artmıyor; iç savaşın devam ettiği Suriye'nin Lirası, ambargo uygulanan İran'ın Riyali, çatışmaların sürdüğü Libya'nın Dinarı, fiili olarak üçe bölünen Irak'ın Dinarı ve borç aldığımız Çin'in Yuanı bile şu an TL karşısında değer kazanıyor.",true,tr
Avustralya’da kadın sayısının erkeklerden beş kat fazla olduğu iddiası,false,tr
"Kannibalismus-Mord: Er schlachtete und aß 23 Pizzaboten, 6 Jehovas-Zeugen und 2 Briefträger in den vergangenen 2 Jahren",false,de
In Dänemark darf die Polizei einige Hunderassen töten lassen - auch Hunde von Touristen,mostly true,de
Gelir dağılımı adaletsizliği açısından dünya üçüncüsüyüz.,false,tr
"Masken schützen nicht, sondern führen zu Atemnot durch Einatmen des ausgeatmeten CO2, Bronchialbeschwerden, Gerstenkorn, Hautjucken, Hautrötung und Pickelbildung",false,de
Sokağa çıkma yasakları sırasında 158 sivil hayatını kaybetti.,true,tr
"AB ortalamasının yüzde 35'inden, yüzde 53'üne yükselen bir refahımız var",false,tr
'Kadınlar insan değil memeli hayvan' haberi parodi,false,tr
"İş Kanunu gereği, kamu kuruluşları yüzde 4, özel sektör yüzde 3 engelli çalıştırmak zorunda. Kamuda, çalışan personelin karşılığı olarak 61 bine yakın engelli çalıştırma zorunluluğu var. Kamuda yaklaşık 35 bin engelli çalışıyor.",mostly true,tr
Dünyanın en çok buğday ithal eden ülkesi haline gelen Türkiye...,false,tr
Personen in Schutzanzügen geben sich als Mitarbeiter des Gesundheitsamts aus,true,de
Kayseri Uçak Fabrikası ve fabrikada üretilen uçaklarla ilgili iddialar,false,tr
بر اساس شاخص برابری جنسیت، ایران رتبه نخست دنیا در عدالت آموزشی و تحصیلی است.,false,fa
"TBMM’de denetim yetkisini kullanan, hukukun üstünlüğünü savunan tek bir parti var, o da CHP’dir",false,tr
Bu yılın ilk 9 ayında havayollarında yolcu trafiği yüzde 18 arttı.,false,tr
Video auf Facebook: bei den angreifern soll es sich um libanesen handeln. tatort soll gelsenkirchen sein!,mostly true,de
Özel şirketlerin borcu 10 kat artmış.,false,tr
میزان ارزبری تولید خودرو ۵۰ درصد کاهش یافته است.,false,fa
"AKP iktidarında (…) iş gücü, bir taşeron işçileri ordusuna dönüşmüştür.",true,tr
Fındığın alım fiyatı 13 yıl önce 5 dolar iken şu anda 2 dolar bile değil.,mostly true,tr
Linke gegen Untersuchungsausschuß zum BAMF-Skandal,true,de
"Milli gelirine oranla, dünyada en yüksek asgari ücrete sahip olan ülkeyiz.",false,tr
"(Açıklanan Mart 2014 işsizlik rakamları üzerine) Şu anda 1,5 milyon istihdam artışı sağlamışız.",false,tr
Turist sayısında yarı yarıya azalma oldu.,false,tr
"Wer MUNDSCHUTZ trägt, STECKT SICH AN! Neue STUDIE!",false,de
Was passiert in Deutschland? Wieso berichten die Medien sowas nicht??,false,de
Kalp krizi geçirirken öksürmenin hayat kurtarabileceği iddiası,false,tr
Flüchtlinge organisieren Menschenjagd in Halle.,false,de
Zitat von Robert Habeck: „Vaterlandsliebe fand ich stets zum Kotzen. Ich wusste mit Deutschland noch nie etwas anzufangen und weiß es bis heute nicht.“,true,de
CDC (USA) muss Corona-Todesrate um 94% nach unten korrigieren!,false,de
Rolf Kron: Corona Virus - Hat der Wahnsinn System?,false,de
Fast 500 Migranten greifen Polizisten in Pforzheim an.,false,de
"Das Gehirn werde durch Sauerstoffmangel dauerhaft beschädigt, wenn man Masken trage.",false,de
Avrupa İnsan Hakları Mahkemesi’nde düşünce ve ifade özgürlüğünden en fazla mahkûm olan ülke Türkiye.,true,tr
۲ درصد از کل صفحات وب دنیا به زبان فارسی‌ است و در این حوزه زبان فارسی از عربی و چینی پیشی گرفته است,mostly true,fa
Merkez Bankası'ndaki rezervimiz de 117 milyar dolar seviyesine çıkmış bulunuyor.,true,tr
Sandık kurullarının kullanacağı tutanaklarda kanuna aykırı değişiklik yapıldığı iddiası,false,tr
Bill Gates rechnet mit 700.000 Impfschäden durch Corona-Impfung und ist verantwortlich für 490.000 gelähmte Kinder in Indien,false,de
"Das Foto zeige den Jungen, der in Frankfurt getötet wurde",false,de
Ei ohne Schale wird im Supermarkt verkauft,false,de
Annesiyle birlikte cezaevinde kalan 0-6 yaş çocukların sayısı,false,tr
Habitat 2 toplantısında sonuç bildirgesine bir şey kaydedildi. Neydi biliyor musunuz? Dünyanın en temiz şehri İstanbul.,false,tr
Son bir yılda imam hatip lisesi sayısı yüzde 22 arttırıldı ama imam hatibe giden öğrenci sayısı son bir yılda yüzde 7 düştü.,mostly true,tr
Videonun tek tuşla renk değiştirebilen Lamborghini aracı gösterdiği iddiası,false,tr
Merkel warnt vor „Angriff“ der Migranten auf Europa,false,de
Datenschutz-Irrsinn: Namen an Klingelschildern und Briefkästen möglicherweise unzulässig,false,de
Faili meçhulleri bu ülkede AK Parti bitirdi.,false,tr
Nüfusun yüzde 50’si kendi seçtiği belediye başkanı tarafından yönetilmiyor.,mostly true,tr
Merkez Bankası son 8 yılda 6 kez enflasyon hedefini ıskalamıştır,true,tr
Rhein-Neckar-Bahn: Asylbewerber fahren umsonst,false,de
Foto zeigt Unruhen in Paris nach dem WM-Sieg vom 15. Juli 2018,false,de
Fotoğrafın Atatürk'ün çocuklarla satranç oynadığını gösterdiği iddiası,false,tr
Meuthen: Schulz gibt es endlich zu – Deutschland soll bis 2025 abgeschafft werden,false,de
Halk Ekmeğe yüzde 40 zam yapıldı.,false,tr
Düzce'deki Rabia heykelinin üç parmağının kırıldığı iddiası,false,tr
Explosion bei einer Gelbwestendemonstration hat in Brüssel stattgefunden,false,de
"Biz iktidara gelene kadarki 41 yılda 450 bin hektar toplulaştırma yapıldı, 12 yıllık AK Parti iktidarında 4,5 milyon hektar toplulaştırma yapıldı, tam 10 misli.",true,tr
Erzurum en fakir 3 ilden bir tanesi.,mostly true,tr
Çocuk suçluluk oranları son 5 yılda yüzde 100 arttı..,mostly true,tr
"Bir destek kanunu var çiftçiyle ilgili. Milli gelirin %1’inden daha az bir pay ayrılmamalıdır diyor. Milli gelirimiz şu anda, birkaç ay önceki rakamla söylüyorum, 4,5 trilyon civarında. %1’i 45 milyar eder, şu anda 16 milyar verildi bu demektir ki 29 milyar daha verilmesi icap ederdi, verilmiyor.",mostly true,tr
Flüchtlinge fahren kostenlos Bahn,mostly true,de
"Yani CHP’nin son 55 yıl içinde tarihi zafer diye andığı 77 seçimleri tek başarı hikayesi, birinci çıktı, şu anda bizim ulaştığımız çizginin altındadır.",mostly true,tr
2017’de bir ayıptan söz edeyim size. 1 milyon 897 bin 524 çocuğumuz okullaşamadı.,true,tr
Şu anda dünyadaki kömür ihtiyacının yüzde 40'ını ABD tek başına karşılıyor.,false,tr
Greta Thunberg mit Plakat: „Ich verdiene mich an Eurer Blödheit dumm & dämlich“,false,de
Ekrem İmamoğlu'nun 'İstanbul İmamlar Birliği' hakkında duyuru yaptığı iddiası,false,tr
Dingil mesafesi 3.20 metrenin üstünde olan araçlar ikinci köprüden geçtiğinde ceza yazıldığı iddiası,false,tr
"Türkiye 2000’lerin başında dünyanın en büyük 15 imalat sanayi ekonomisinden biri iken, bu ligden düştü.",true,tr
Fotonun koronavirusdan ölən Türk həkim Seyfi Al ilə oğlunun son görüşünü göstərdiyi iddiası,false,tr
Verschlüsselte E-Mails sind nicht sicher,mostly true,de
"Geçen hafta Meclis'te, bir haftada 100'ün üstünde kanun çıktı. Niye kimsenin haberi olmadı? Kavga olmadı, dövüş olmadı.",true,tr
(Türkiye) 34 yıl boyunca ya 2 haneli ya da 3 haneli enflasyon dönemlerini yaşadı... tek haneli rakam 2004 yılında görüldü...2012 yılında enflasyonda ulaşılan rakamın son 44 yılın en düşük oranı,true,tr
8 milyon dolarla Başkent Gaz 312 bin evin bir yıllık doğalgazını ödeyebiliyor,false,tr
Bugünkü kriz döneminde dahi 950 milyardan 750 milyara düşmüş milli gelirimize rağmen bölgenin en büyük ekonomisi. (Orta Doğu ve komşu ülkeler),false,tr
"Türkiye, Yaşam Kalitesi Endeksi'nde maalesef son sıralarda.",mostly true,tr
Behauptungen zu Impfzwang und Bill & Melinda Gates Stiftung,false,de
„AfD-Politikerin Alice Weidel tritt nach Strache-Video zurück“,false,de
Zitate der Grünen,false,de
"2002’de göreve geldiğimizde 848 bin olan lisanslı sporcu sayısı, şu anda 8 milyon 105 bin.",mostly true,tr
"Es gibt Patente zum aktuellen Coronavirus, u.a. hat Bill Gates eines und er hat auch den Ausbruch vorhergesagt.",false,de
Vitamin D soll verboten werden,false,de
Diş hekimi Zarife Doğan'ın cansız bedenine ulaşıldığı iddiası,false,tr
Das Coronavirus gehe bei 40 Grad „kaputt“ und „Überwärmungsbäder“ seien ein „wunderbarer Schutz“ gegen das Virus,false,de
پشت‌بام خوابی، شایعه رسانه‌های ضد انقلاب است.,false,fa
شهروندان افغانستانی در ایران دو میلیون فرصت شغلی دارند و سالانه سه تا چهار میلیارد یورو از کشور ما خارج می‌کنند.,false,fa
Osman Sarıgün'ü serbest bırakan savcı Ensar Vakfı'nın Ankara Şube Başkanı mıydı?,true,tr
Şu anda Türkiye'de toplam 18 bireysel emeklilik şirketi var. Bunlardan 14'ü yabancı…,false,tr
Türkiye'ye giren sermaye dijital sermayedir. Sadece bilgisayar ekranlarında görünen bu sermaye istihdamı ve üretimi arttırmıyor.,false,tr
"Auch wenn die Ehefrau erst 6 und der Mann 56 ist, können wir nicht einfach unterstellen, die Heirat wäre nicht aus Liebe vollzogen",false,de
Türkiye iş cinayetlerine rekora koşuyor. Sadece Ağustos ayında 158 işçi hayatını yitirdi.,mostly true,tr
Jusos wollen Abtreibungen bis zum letzten Tag des 9. Monats legalisieren,false,de
"Finanzminister will 78 Milliarden für Migranten ausgeben. Davon sollen 31 Milliarden nicht den hier lebenden Migranten zukommen, sondern Familienangehörige, die noch in den zumeist muslimischen Herkunftsländern leben.",false,de
Willkommen im Schlaraffenland!,false,de
Vier Millionen Menschen demonstrieren in Berlin gegen Corona-Maßnahmen,false,de
Mevcut öğretmen sayısının yüzde 55'i iktidarımız döneminde atanmıştır.,false,tr
"Polizei Berlin fordert Bürger auf, Gaststätten zu melden, die gegen die Sperrstunde verstoßen",false,de
Kırılan tasarruflu ampullerin cıva zehirlenmesine sebep olabildiği iddiası,true,tr
"Sokağa çıkma yasaklarının hiçbir hukuki temeli yoktur. Gösterilen hukuki temel tamamen dayanaktan yoksundur… İki kanunda sokağa çıkma yasağı vardır; birisi olağanüstü haldir, diğeri sıkıyönetimdir.",true,tr
NASA vs Diyanet - 4: Kadının toplumsal rolüne bakış açısından karşılaştırmalar,true,tr
"Chlordioxid heilt Covid-19, Covid-19 ist keine Atemwegserkrankung, es gibt einen Zusammenhang zwischen 5G und dem Coronavirus",false,de
