claim,label
"Ekim ayının sanayi üretimi bir önceki yılın aynı ayına göre yüzde 4,6 oranında önemli bir artış gösterdi. 2005’ten bu yana en yüksek seviyeye ulaştık.",true
"Yüzde 2,9 büyüme demek, esasında vatandaş fakirleşiyor demek.",mostly true
Xavier Naidoo zweifelt an Existenz des Coronavirus und verlangt „Beweise“,mostly false
Brief eines Polizeioberkommissars aus Chemnitz über einen Vorfall beim Bürgerfest,false
George Friedman'ın 'Türkiye 2050’de süper güç olacak' dediği iddiası,mostly false
Ekonomik özgürlükler endeksinde 180 ülke içinde 68. sıradayız.,mostly true
AB ile 150 milyar dolarlık ticaret hacmimiz var.,true
Videonun iki Türk’ün ABD’de mahkemeye çıktığını gösterdiği iddiası,true
Enerji talep artışında OECD ülkeleri arasında dünyada Çin'in ardından ikinci sıradayız.,mostly true
Ölen sahibinin fotoğrafını telefonda gören kedi videosu,false
"Hastane yatak kapasitesini 136 bin ilaveyle 240 bine, doktor sayısını 94 bin ilaveyle 231 bine ve toplam sağlık çalışanı sayısını da 550 bin ilaveyle 928 bine yükselttik.",mostly false
Dünyanın en çok buğday ithal eden ülkesi haline gelen Türkiye...,false
Fotoğrafların Uygur Türklerine yönelik katliam ve işkenceleri gösterdiği iddiası,mostly false
"Son 15 yılın performansına bakıyorum, her alanda olduğu gibi tarım alanında da 3-4 misli büyümemiz olmuş.",mostly true
"Tafeln, Bundestagsdiäten, Kinderarmut",mostly true
"Die Seite „journalistenwatch.com” schreibt, der Togolese, der in Ellwangen zunächst nicht abgeschoben werden konnte, sei noch immer nicht in Abschiebehaft.",mostly false
Türkiye ekonomisi tüm başlıklarda gelişmiş ülkelerden dahi çok ileri seviyededir. Dünyada bir numara.,false
در چند سال اخیر ۴۰۰هزار نفر از خوزستان به سمت شمال کشور مهاجرت کرده‌اند,false
Alle Jobcenter ab Mittwoch wegen Corona geschlossen,mostly true
"Die Seite „politikstube.com” suggeriert, dass die Stadt Rottweil besonders teuer ausgestattete Wohnungen für Flüchtlinge baut.",mostly true
Türkiye dünyada en fazla silah ithalatı yapan 7. ülke.,true
"Erdoğan'ın Gazze hassasiyeti lafta. Gazze'ye yardım için düzenlenen uluslararası toplantıda 30 ülke var, Türkiye yok.",false
"OECD ülkelerinde on bin kişiye 37 doktor düşüyor. Bu sayı bizde 17, Yunanistan’da 72. On bin nüfusa 17 hekimin düştüğü bir ülkede dünya ile yarışan bir sağlık hizmeti vermeye çalışıyoruz.",mostly true
Türkiye’de 268 tane dev barajı inşa eden biziz.,mostly false
"Angebliches Voltaire-Zitat: „Wenn du wissen willst, wer dich beherrscht, finde heraus, wen du nicht kritisieren darfst.“",false
Şu anda dünyadaki kömür ihtiyacının yüzde 40'ını ABD tek başına karşılıyor.,false
"Türkiye’de yılda 8,6 milyon ton plastik üretiliyor. 2018'de ayda 20 bin ton plastik atık ithal ettik. Bunların sadece %1'i geri dönüşüme uğruyor.",true
(Eğitime ayrılan bütçede) 2002 yılına kıyasla yüzde 726'lık bir artış oldu ve 62 milyara yükselttik.,mostly false
"Türkiye 2000’lerin başında dünyanın en büyük 15 imalat sanayi ekonomisinden biri iken, bu ligden düştü.",true
"12 aylık cari işlemler açığı 51,6 milyar dolara ulaştı. Neredeyse GSYH’nın yüzde 6’sı! Bize benzeyen ekonomilerde bu oran neredeyse üçte biri düzeyinde.",true
Mevsimsellikten arındırılmış işsizlik oranı Haziran’da yüzde 10.9 ile son 70 ayın zirvesine çıktı.,true
(Yasa dışı göçmenlere atfen) Türkiye’den ne kadar gitmiş? Bunun dörtte 1’i civarında her sene gidiyor ama bir önceki yılla mukayese edildiğinde ciddi bir düşüş söz konusu Türkiye’den Avrupa’ya geçişlerde,mostly true
"AK Parti iktidara geldiğinde Ankara’da 84 büyükelçilik vardı, şimdi 117 büyükelçilik var.",mostly true
"1986 yılında nükleerin elektrik üretimindeki payı yüzde 16’ydı, bugün yüzde 11’e düştü.",mostly true
Kümbetin arkasına öğrenci yurdu yapıldığı iddiası,true
بررسی ادعاهای شاخ‌دار علی‌اصغر برهمند؛ از پیش‌بینی زلزله تا ساخت سپر بیولوژیکی کرونا,false
سالانه ۱۷ هزار نفر در تصادفات جاده‌ای ایران کشته می‌شوند.,true
Vermisst! Bitte teilt das weiter,mostly true
قطعی اینترنت یک موضوع منحصر به ایران نیست. در یک‌ سال گذشته ۱۹ بار قطعی اینترنت به دلایل امنیتی در هندوستان، پاکستان، عراق و کشورهای دیگر داشته‌ایم.,mostly true
"Covid-19 ist keine gefährliche Krankheit, sondern eine Laborpandemie",mostly false
Çaykur Varlık Fonu'na devredildiğinden beri zarar ediyor: Kâr öngördü zarar 657 milyon oldu,true
"Avrupa’da pek çok başkent on milyonlarla ifade edilen turist alırken,  Ankara’ya gelen turist sayısı yarım milyonu dahi bulmamaktadır. Avrupa başkentleri turizmden milyarlarca dolar kazanırken, Ankara sadece bu tabloyu seyretmektedir.",mostly true
"Milli Eğitim'in bütçesi 7 milyar TL iken, bu sene 70 milyar TL'ye yükselttik.",mostly false
"Zarar eden PTT, geçen yıl itibarıyla cirosunu 1 milyar doların üzerine çıkarmıştır. 200 milyon dolar civarında da bir net karı var.",mostly true
In Dänemark darf die Polizei einige Hunderassen töten lassen - auch Hunde von Touristen,mostly true
"Kredi kartı borcunun bir yılda arttığı noktaya bakın. Geçen seneden bu seneye, 3 milyon 103 bin iken şimdi 5,6'ya çıkmış.",mostly false
Grönlands grösster Gletscher wächst plötzlich und Eisfläche des Südpols ist stark gewachsen - Klimatologen der NASA lagen falsch,mostly false
"2015'te, yüzde 3.8'lik son çeyrekteki büyümemizle beraber, dünyanın en hızlı büyüyen yedinci ülkesiyiz.",false
"Tüketici kredisi, banka kredi kartı borç batağıdır. Borç batağındaki vatandaş sayımız 5 milyon",false
İkisinin de kapısına kilit vuruluyordu AK Parti geldiğinde. Şimdi o kapanacak şirketler(savunma sanayisinden) dünyanın en büyük 100 şirketi arasına girdi.,mostly false
Diese Bilder zeigen aktuelle Brände im Amazonasgebiet. Medien berichten nicht darüber.,false
"Bu iktidar elinde, iki Trakya’dan daha büyük bir alan artık ekilip biçilmiyor.",mostly true
Flüchtlinge kosten Deutschland bis zu 55 Milliarden Euro jährlich,false
Dünyanın hiçbir yerinde Allah vurgusuyla anayasa yoktur.,false
Sozialminister Manne Luche fordert Impfung mit giftigem Formaldehyd,mostly false
Türkiye Avrupa'nın birinci tarımsal gücü haline geldi,true
"Frankreich übergibt Gesetz, das sagt, dass Kinder Sex mit Erwachsenen zustimmen können",false
Türkiye 16 yıl aradan sonra canlı hayvan ve et ithal ediyor.,false
بنابر اعلام بانک جهانی، درصد مردمی که قبل از انقلاب زیر خط فقر زندگی می کردند ٤٦ درصد بوده و در سال ٩٤ حدود ١٠ درصد بوده است که این کاهش ٣٦ درصدی افتخاری بزرگ برای نظام اسلامی است.,false
"Bir zamanlar 1 milyon lira varmış. Sonra 6 sıfır atılmış, 1 lira olmuş 1 milyon lira. O zamanlar 1 milyon lira ile 78 gram et alınabiliyormuş. Şimdinin 1 lirası ile 25 gram!",mostly true
Pflegekräfte aus der Türkei Anwerbeabkommen: 50.000 Türken sollen nach Deutschland kommen,false
80 yılda yapılan 58 fen lisesi sayısını 302´ye çıkardık.,mostly true
Enerji talep artışında OECD ülkeleri arasında dünyada Çin'in ardından ikinci sıradayız.,mostly true
Mehmet Özhaseki'yi Afrika'daki Fethullahçı bir okulun önünde gösteren fotoğraf iddiası,true
2007-2018 yılları arasında genç istihdamını en fazla artıran ülke olduk Avrupa Birliği'nde.,mostly false
در این دولت برای اولین بار در برداشت گاز از پارس جنوبی از قطری‌ها پیشی گرفته‌ایم.,true
Transatlantische Verflechtungen der Grünen,mostly true
Der Samenabdruck des ersten Mannes bleibt für immer.,false
"Neymiş? 1923-1950 arasında yapılan toplam 3,4 milyar dolar ihracat şimdi bir haftada yapılıyormuş! İyi de aynı dönemde Türkiye’nin dış ticaret açığı sıfır! Bugün ise haftada 1,2 milyar doları buluyor.",true
Elazığ’da deprem sonrası sığınılması gereken yerlerle ilgili iddialar,mostly false
"Türkei hat Italien geholfen, 200.000 Masken und Beatmungsgeräte wurden abgeholt",mostly false
"Eskiden…üniversite sınavına giren kişi sayısıyla, üniversiteye kayıt yaptırma hakkı elde edebilen kişi sayısı arasında 10 kata varan bir fark vardı.",false
"Angeblicher Fyler „Kein Sex mit Nazi“, gefördert durch Bundesfamilienministerium",mostly true
Güney Kore'de kısa giyen kadınların tutuklanma ihtimalinin olduğu iddiası,false
In Hessen werden Grundschüler verpflichtend über Homo-Ehe und Analverkehr aufgeklärt,mostly false
Fotoğrafın ABD Başkanı Donald Trump'ın öldüğü anı gösterdiği iddiası,false
Hurma ithalatının yüzde 51'inin İsrail'den yapıldığı iddiası,mostly false
"In Griechenland rücken Bauern aus, um ihr Land vor Migranten zu verteidigen",false
"İstanbul’da denizin altından biliyorsunuz Marmaray’ı yaptık, bunu yapan biziz. Bununla ilgili ne Demirel’in, ne Ecevit’in burayla ilgili en ufak bir katkısı yok.",mostly false
"ABD’de başkan, başkanlık sarayında oturur. Kirasını öder, yediği yemeğin faturasını öder. Evine misafir geldiğinde 5 yıldızlı otelin tarifesi üzerinden o misafirlerine ikram ettiği yemeğin bedelini öder.",mostly false
"Geçen hafta Meclis'te, bir haftada 100'ün üstünde kanun çıktı. Niye kimsenin haberi olmadı? Kavga olmadı, dövüş olmadı.",true
آیت‌الله احمد جنتی با در دست داشتن لیست انتخاباتی اصول‌گرایان هنگام رای‌گیری مرتکب تخلف نشده است.,false
[برخی] حقوقدانان شورای نگهبان تحصیلکرده انگلیس‌اند.,true
نظارت مجمع قانونی است و وظیفه هیات عالی نظارت، انطباق مصوبات مجلس با سیاست‌های کلی است.,mostly false
"2014 yılında dünyanın 23 büyük ekonomisi içerisinde (ahbap-çavuş ekonomisi) kapsamında 14. sırada olan Türkiye, 2016’da 8. sıraya çıktı.",true
"Spor desen, bu şehir 25 yıldır milli maç yüzü görmemiş.",mostly false
Neuwertige Geräte aus einer Flüchtlingsunterkunft werden entsorgt,mostly false
"Kriminelle verteilen an Haustüren Masken mit Betäubungsmittel, um Leute auszurauben",false
"Dünyada birçok ekonominin deflasyon riskiyle karşı karşıya kaldığı ve büyümenin son derece düşük olduğu 2014'te, Türkiye ekonomisi 3,3 büyüme kaydetmiştir.",mostly false
"Büyüme rakamımız, AB ortalamasının neredeyse iki katına çıktı.",true
Ben 2002’de Hazineden sorumlu bakan olarak başladığımda Türkiye’de faizler %66 idi. Enflasyon %29’du. Ülkede 35 yıl çift haneli enflasyon görmüştük. Tek haneli enflasyonu Türkiye’de hemen birkaç yıl içerisinde gördük.,mostly true
"AK Parti iktidara geldiğinde Ankara’da 84 büyükelçilik vardı, şimdi 117 büyükelçilik var.",mostly true
Sizin hükûmeti devraldığınız 2002 yılında Türkiye'nin dolar milyarderi sayısı 5'ti. On üç yılda bu sayıyı 10'a katladınız.,mostly false
EU-Richtlinie erlaubt Verwendung von streunenden Haustieren für Tierversuche,mostly false
AK Parti iktidara gelmeden önce ataması yapılmamış öğretmen kalmayacağını vaad etti.,mostly true
Syrischer Muslim mit 4 Frauen und 23 Kindern erhält monatlich 30.000 Euro Sozialhilfe.,false
طی سال‌های آینده جامعه ایران با سونامی سالمندی روبه‌رو خواهد شد.,mostly true
"Aktion Familie & Kind schreibt in einem Brief, dass nur Flüchtlingskinder auf eine Reise mitgenommen werden",false
Habitat 2 toplantısında sonuç bildirgesine bir şey kaydedildi. Neydi biliyor musunuz? Dünyanın en temiz şehri İstanbul.,false
Bayern zahlt keine Sofort-Hilfe für Unternehmen bis 10 Mitarbeiter – Enttäuschung für viele Unternehmen,mostly false
"Bir röntgen cihazından alacağınız radyasyon, bir nükleer santralden 1 yılda alacağınız radyasyondan daha fazla",true
Geçen yıl Türkiye halkının da desteğiyle Somali'ye 400 milyon dolar yardım ettik.,mostly false
"(DSP-MHP-ANAP hükümeti için) IMF’e borçlandılar, ne kadar? 23,5 milyar dolar.",true
Mehr als 1 Milliarde Euro kostet uns der Deutsche Bundestag,mostly false
Türkiye’de bugün 3 milyon işsiz var. Bunların 1 milyonu üniversite mezunu.,mostly true
"Helikopterini, tankını ve savunma sanayiinin yüzde 75’ni yapan ülke olduk",mostly false
İbuprofenin yeni koronavirüsün yol açtığı hastalığı ağırlaştırdığı iddiası,mostly false
Zum Nachdenken,false
"Eine Asylbewerberfamilie, die noch nie in das System eingezahlt hat, erhält monatlich 3916,83 Euro netto, zuzüglich Krankenversicherung, zuzüglich Wohnung oder Haus.",mostly false
Xavier Naidoo zweifelt an Existenz des Coronavirus und verlangt „Beweise“,mostly false
2015 yılında tarım iş kolunda hayatını kaybeden işçi sayısı 190'a yükseldi.,true
Fotoğrafın Birinci Dünya Savaşı'ndan kaçıp Müslüman ülkelere sığınan Avrupalıları gösterdiği iddiası,false
Flüchtlinge fahren kostenlos Bahn,mostly true
ما اعدام دختر ۹ ساله و پسر ۱۵ ساله و یا حتی سنگسار نداشته و نداریم.,false
2017’de 901 milyon kira ödemiş devlet. Araç kirası olarak 549 milyon kira ödemişler.,true
İsviçre’de Matterhorn Dağı’na Türk bayrağı yansıtıldığı iddiası,true
Avrupa ülkeleri ile karşılaştıran zihniyet bilsin ki (Türkiye’de asgari ücret) satın alma gücü paritesinde diğer ülkelerin asgari ücretleriyle yarışabilecek seviyede.,mostly false
ویدیوی شلیک کشتی چینی به لنج ایرانی و قتل ماهیگیران ایرانی,false
"2002 yılından beri Türkiye ekonomisinin seyrine bakıldığı zaman, hedeflerin büyük oranda tutturulmuş olduğunu görüyoruz.",mostly false
Ebola ist in Italien ausgebrochen. Mittlerweile sind 40 Fälle von Ebola in Italien registriert.,false
ثروت ۲۶ نفر معادل ثروت نیمی از مردم جهان است.,true
"AB ortalamasının %14,3, OECD ortalamasının %11,2, Güney Kore’nin %10,4, Meksika’nın %7,2 sahip olduğu bir dönemde, %25'in üzerinde genç işsizlik oranı",mostly true
"Türkiye'de Süryanice eğitim veren okul bulunmuyor, 1928'de kapatılan son okuldan sonra bu eğitim yapılamıyor, sadece bir anaokulu var.",true
Mehmet Özhaseki'yi Afrika'daki Fethullahçı bir okulun önünde gösteren fotoğraf iddiası,true
"Gençliğimizde 10 kişiden biri üniversiteye girebiliyordu, artık açıkta kalma yok.",false
"Son 15 yılda, 241 polis, 91 asker, 17 özel timci, 15 korucu ve 45 gardiyan tecavüz suçundan yargılandı, ancak hiçbiri ceza almadı.",mostly false
Pentagon’un UFO görüntüleri yayınladığı iddiası,true
Türkiye dünyanın en uzun köprüsünü Marmara Denizi'nin üzerine yapmaya başladı.,mostly false
Cumhurbaşkanlığı Külliyesi'nde zikir,true
"Zarar eden PTT, geçen yıl itibarıyla cirosunu 1 milyar doların üzerine çıkarmıştır. 200 milyon dolar civarında da bir net karı var.",mostly true
AKP iktidarında Sağlık Bakanlığı’nın hastane sayısı yüzde 10 artarken özel hastane sayısı yüzde 102 artış gösterdi.,true
در بین اقشار، بیشترین و بالاترین آمار شهدا مربوط به صنف روحانیت است.,false
Türkiye'nin artık cari açık diye bir sorunu kalmamıştır.,false
"Das sind die Bilder, die die Medien und die Regierungen uns vorenthalten. SO geht Macron mit friedlichen Demonstranten um!",mostly false
AstraZeneca muss Impfstoff zurückziehen,mostly false
Kamudan KHK’ler ile ihraç edilenlerin 41.705’i (yüzde 31) eğitim ve yükseköğretim kurumlarından.,mostly true
"'İstihdamı artıracağız' dediler, işsizlik rekoru kırdılar.",mostly true
Asylbewerber bekommen den Führerschein zum Nulltarif,mostly false
Großbritannien schlägt sieben Jahre Gefängnis für die Kritik am Islam vor,mostly false
Aussagen aus dem AfD-Wahlprogramm für Sachsen,mostly true
"2002 yılında 36,9 milyar lira olan tarımsal gelirimizi 2017 yılına geldiğimiz zaman 188 milyar liraya çıkarmışız.",mostly false
"Daten der Helios-Kliniken belegten, dass so gut wie keine Intensivbetten mit Covid-19-Patienten belegt seien, die Pandemie sei also nicht gefährlich.",mostly false
سالانه ۱۷ هزار نفر در تصادفات جاده‌ای ایران کشته می‌شوند.,true
Video von einer mit Gülle besprühten Präfektur in Frankreich,false
Die Anwesenheit des Kindes in der Schule reicht laut WHO als Einwilligung zur Impfung,mostly true
Madenlerde bu AKP döneminde iş kazası artmış.,mostly false
BM'de temsil edilmeyen bir gücün Türkiye'den geçmesine izin verilerek Türkiye anayasal bir suç işlemektedir.,false
„Corona-Regeln: Sachsen droht Eltern mit Kindesentzug“,mostly true
(2014 ilk çeyrek için açıklanan milli gelir hakkında) Yüzde 7 reel olarak dolar bazında düştü.,mostly false
Boşanma oranlarında son 6 yılın en düşük rakamlarını bu yıl yakalamış olduk.,true
گفت‌و‌گوی ضبط شده دو خبرنگار آمریکایی در کاخ سفید درباره «سرکاری بودن کرونا» و اینکه «واکسن کووید۱۹ زده‌اند»,mostly false
Churchill heykelinin kaplaması üzerine 'açmayın içinde ırkçı var' yazıldığını gösteren fotoğraf montaj,false
Kamu İhale Kanunu 12 yılda dolaylı ve direkt olarak tam 164 defa değiştirilmiştir,mostly true
"Dünyada ihtiyaç duyulan elektriğin yüzde 66'sı fosil yakıtlardan üretiliyor. Türkiye yüzde 32,2 yenilenebilir kaynaklardan elektrik üretim değeri ile dünya ve Avrupa ortalamasının üstünde yer alıyor.",true
5G führt zu Blutgerinnung und Sauerstoffmangel,false
"TSK NATO’nun 2. büyük ordusu, dünyanın 5. büyük ordusudur",mostly false
Türkiye'de asgari ücret 280 dolara indi. 280 dolarlık asgari ücret Avrupa'nın neresinde var?,mostly true
"Enerji Bakanı kamuoyunu yanlış bilgilendiriyor, Şırnak'ta %80 kaçak doğru değil",mostly false
"Özel sektörde; finansal kesimin dış borcu 170 milyar $, reel kesimin dış borcu 150 milyar $ olmak üzere, özel sektörün toplam dış borcu 320 milyar $’a yükseldi.",mostly true
"Dokumente zeigen: Obama befahl der CIA, ISIS auszubilden",false
Avrupa'da en ucuz doğalgaz satan ülke Türkiye'dir. Elektrikte de en ucuz satan ilk 5 ülke arasındadır.,false
"Bakın, Çandarlı Limanı bittiği zaman, arka planda dünyanın en önemli, Rotterdam Limanı'ndan daha büyük, muhteşem bir ihracat üssü olacak.",false
Paris'te sokak yıkanan suda yeni koronavirüs tespit edildi diye çatışma çıktığı iddiası,false
Armutsmigrant schleift 3 Jährige vom Campingplatz ins Gebüsch um sie zu vergewaltigen,mostly false
"İş Kanunu gereği, kamu kuruluşları yüzde 4, özel sektör yüzde 3 engelli çalıştırmak zorunda. Kamuda, çalışan personelin karşılığı olarak 61 bine yakın engelli çalıştırma zorunluluğu var. Kamuda yaklaşık 35 bin engelli çalışıyor.",mostly true
Anayasa Uzlaşma Komisyonu’nun 21 aylık süresinde Meclis’te temsil edilen partilerin dördünün de anayasa taslağı olmadı,mostly false
"''(Tasarruf oranları) Çin'de yüzde 52, Hindistan'da yüzde 35, AB'de ülkeye göre yüzde 22, 23, 24 olan tasarruf oranlarının Türkiye'de ise halen yüzde 13.4''",mostly true
Videonun İstanbul Havalimanı’nın sular altında kaldığını gösterdiği iddiası,false
CLAIM: The Facebook lives from ISS broadcasted by UNILAD and Viral USA are fake.,true
"Ağustos ayında TL %40 a yakın değer kaybetti, bu Türkiye dalgalı döviz kuruna geçtiği 2002 yılından beri en yüksek değer yitirişi",false
"Pille gegen Hepatitis C kostet in Deutschland 100.000 Euro, in Indien 800 Euro",mostly false
"Türkiye artık 16 büyük ekonomiden birisi değil, en kırılgan ekonomiye sahip, büyümesi de azalmış bir ülke.",mostly true
Der Corona-Test verursacht eine hämato-enzephalische Barriere Schädigung in der Schädeltiefe.,false
Türkiye'de asgari ücret 280 dolara indi. 280 dolarlık asgari ücret Avrupa'nın neresinde var?,mostly true
رشد پایه پولی سال ۱۳۹۸ فاصله چندانی با متوسط ۵۰ ساله ندارد.,false
"Geçen yılı 12,3 milyar dolarlık uluslararası yatırımla kapattık. Bu yılın ilk dört ayında 3,6 milyar ile geçen yılın üzerine çıktık. Amerika ve Avrupa ile birlikte Körfez ve Uzak Doğu Asya ülkelerinin payının da giderek yükseldiğini görüyoruz.",mostly false
Karussellautos sind jetzt tabu,false
"Türkiye’de üniversite öğrencisi sayısı iki milyon civarında, ancak onlar için sağlanan yurt sayısı bunun onda biri.",false
"Çin’in, İsrail’in ihracatının üçte birini, yüksek teknolojili ürünler oluştururken, bizim ihracatımızda, yüksek teknolojili ürünlerin oranı yüzde beş bile değil",mostly true
"Bizim görevde olduğumuz dönemde, benim bakanlıktan ayrıldığım dönemde Hazine yaklaşık yüzde 10 faizle borçlanıyordu. Enflasyon %7 idi.",mostly true
Syrer- Gang schießt und sticht Mann in Neu Anspach mit Messer krankenhausreif,mostly false
"2003’te hanehalkı borcunun gelire oranı yüzde 5,1 iken, bu oran 2014’ün ilk 6 ayında yüzde 54 oldu.",true
Yirmi yıl içerisinde 4 bin metreküp olan kişi başına düşen su miktarı 1.400 metreküpe düştü.,mostly false
"İstanbul’da denizin altından biliyorsunuz Marmaray’ı yaptık, bunu yapan biziz. Bununla ilgili ne Demirel’in, ne Ecevit’in burayla ilgili en ufak bir katkısı yok.",mostly false
"1986 yılında nükleerin elektrik üretimindeki payı yüzde 16’ydı, bugün yüzde 11’e düştü.",mostly true
"Angela Merkel bekommt ab dem 1. April eine Gehaltserhöhung von 760 Euro. Somit steigt ihr Gehalt von 24.300 Euro auf 25.060 Euro. Zudem steigen die Gehälter der Minister von 20.820 auf 21.460, sowie die der Parlamentarischen Staatssekretäre von 18.260 auf 18.000 pro Monat.",mostly false
"NASA, sülfür dioksit ve asit yağmuru tehlikesi",true
"2019 Mart’ında 120 milyon $ olan cari açık 2020 mart ayında, 1 ayı söylüyorum 40 kat artmış değerli arkadaşlar, 40 kat",true
"Almanya'da neredeyse güneş yok, neredeyse enerjisinin üçte birini güneş enerjisinden sağlıyor.",false
Türkiye’nin Irak’la olan ihracatı Haziran ayında yüzde 21'e gerilemiştir”',true
Seçim bir siyasi faaliyet değildir.,false
İçinden plastik çıkan Mars ve Snickers marka çikolataların toplatıldığı iddiası,true
dünyanın hiçbir ülkesinde Cumhurbaşkanı ayrı bir hukuksal korumaya bürünmüyor.,false
Sendika ve sivil toplum örgütlerinin verilerine göre son 10 yılda en az 12 bin işçi yaşamını yitirdi.,true
Vergi gelirleri misli ile 4-5 kat arttı.,mostly false
Bild mit mehreren Behauptungen zu Wahlprogramm der AfD 2017,mostly false
Fotonun koronavirusdan ölən Türk həkim Seyfi Al ilə oğlunun son görüşünü göstərdiyi iddiası,false
Mescid-i Haram’da çekirge istilası yüzünden namaz kılınamadığı iddiası,false
Finanzämter gehen gegen zu günstige Mieten vor,true
2002 yılında hızlı bant internet kullanan kişi sayısı 20 bindi. Biz birçok Afrika ülkesinden daha kötü durumdaydık. Bugün ki kullanıcı sayımız 40 milyona dayandı.,mostly false
PTT'nin bekçi alımı için ücreti 250 TL olan bir sınav yaptığı ve bu sınava 350 bin kişinin başvurduğu iddiası,false
"Doğalgaz santralleri elektrik üretmiyor… Kasım ayında elektriğin yüzde 37’si bu santrallerde yapılıyordu, yüzde 17’ye düştü bu oran.",mostly false
"Türkiye, karbon salımı en çok artan ülkelerden birisi, hiçbir tedbir alınmıyor.",true
80 yılda yapılan 58 fen lisesi sayısını 302´ye çıkardık.,mostly true
Bauer versus Aslyant,false
"İhracatta 6 milyar, turizmde 6-7 milyar dolar Rusya'dan gelir elde ediyoruz. Bir de bavul ticareti var; 2013'te 8,5 milyar, 2014'te 6 milyar dolara düşen bir tablo. Kriz derinleşirse, Türkiye'nin 20 milyar dolar kaybı olacağı göz önünde bulundurulmalı.",mostly true
Vorprogrammierter Wahlbetrug in Bayern: Fehlende Briefwahlstimmen werden mit GRÜN aufgefüllt,false
Dalai Lama: Europa gehört den Europäern und Flüchtlinge müssen nach Hause gehen,mostly true
"200 milyar dolara yakın bir bütçemiz var bizim 2016’da. Yalnız bu bütçenin çoğu, personel harcamalarına, cari harcamalara gidiyor. 200 milyar dolarlık bütçenin ancak 10’da 1'i yatırımlara gidiyor.",true
"Almanya Türkiye'nin bir numaralı ticari ortağı, Hollanda da Türkiye'de en büyük doğrudan yatırım yapan ülke konumundadır.",true
AKP’nin uyguladığı enerji politikaları dışa bağımlılık üzerine kurulu. 2000’de yüzde 67 olan enerjide dışa bağımlılık 2017’de yüzde 76’ya ulaştı.,mostly true
Rentenvergleich Österreich und Deutschland,mostly true
Nasreddin Hoca kitabında çok eşlilikten bahsedildiği iddiası,true
Mersin İl Müftülüğü'ne çocuk evlendirme dairesi pankartı asıldığı iddiası,mostly false
Fotoğraftaki yılan montajlanmış,false
Flüchtlinge fahren kostenlos Bahn,mostly true
Rumeli Hisarı'na mescit yapıldığı iddiası,true
