claim,label
"1990'ların başında rahmetli Özal bu memleketi teslim ettiği zaman kişi başına düşen gelir, 2002 yılında AK Parti iktidarından önce daha aşağı düştü.",false
Altyapı yatırımları noktasında dünyada ikinci sırada olan müteahhitlerimizin yapacağı çok şey olduğuna inanıyorum.,mostly false
"Auch wenn die Ehefrau erst 6 und der Mann 56 ist, können wir nicht einfach unterstellen, die Heirat wäre nicht aus Liebe vollzogen",false
هیچ یک از روسای قوه قضاییه تا کنون تحصیلات حقوقی نداشته‌اند.,true
"Dünyada gıda fiyatları bir yılda yüzde 20 gerilemiştir. Çelişkiye bakınız ki, Dünyada gıda ürünleri ucuzlarken, bizde artmaktadır.",mostly true
"Wir finden keine 24, sondern nur 23 Fälle. Davon abgeschlossen ist nur einziger Fall.",mostly false
"Biz iktidara geldiğimizde Türkiye dünya ekonomi liginde 26’ncı sıradaydı, şimdi 16’ncı büyük ekonomik gücü, Avrupa’nın da 6’ncı büyük ekonomik gücü.",mostly false
"İstihdam yaratma potansiyelimiz 90'lar seviyesinde olsaydı, bugün işsisizlik yüzde 14 seviyesine çıkar ve işsiz sayımız 3,5 milyon kişi daha fazla olurdu.",mostly false
"Enflasyon yüzde 30’tu, şimdi tek haneli rakamda.",true
Türkiye iş cinayetlerine rekora koşuyor. Sadece Ağustos ayında 158 işçi hayatını yitirdi.,mostly true
A Haber'in Muharrem İnce'nin İzmir mitingine katılım olmadı alt bandı kullandığı iddiası,false
Die Zahl der Messer-Angriffe in Deutschland nimmt dramatisch zu.,mostly false
Foto von schreiendem Affen mit Jungem soll angeblich aus Amazonas-Gebiet stammen,false
Afrika'daki en büyük ticaret ortağımız Cezayir'dir.,false
رهبری در انتصاب‌هایش از همه گروه‌های سیاسی بهره می‌برد.,false
"Geteilter Kettenbrief in Niedersachsen: Verbrecher geben vor, Rauchmelder prüfen zu wollen, um in Wohnung zu gelangen",true
طبق آمار وزارت کشاورزی آمریکا ۴۱ میلیون نفر با مشکل گرسنگی دست و پنجه نرم می‌کنند.,true
2013'te bir eylemde karşı karşıya gelen Desi ve Ivan'ın hikayesi,true
Borçların tüketici gelirlerine oranı yüzde 4'lerden yüzde 50'lerin üzerine çıkmıştır.,true
ایران سومین کشور جهان در تولید مدرک دانشگاهی است.,mostly true
Vatandaşların bankalara 424 milyar borcu bulunuyor.,true
Videodaki domuzlar koronavirüs nedeniyle diri diri gömülmüyor,mostly false
Entwicklung der CO2-Emissionen von Deutschland und weltweit,true
Migranten verfügen über namenlose Mastercards mit EU- und UNHCR-Logo,mostly false
Cumhurbaşkanlarının CSO’yu dinleme sayılarına dair iddialar,mostly false
Einnahmen durch Pfandflaschen sollen künftig versteuert werden,false
"2013 yılındaki 407 bin iş davasının 190 bini sonuçlandırıldı, 217 bini sonraki yıla devretti.",mostly true
„Corona-Regeln: Sachsen droht Eltern mit Kindesentzug“,mostly true
"AK Parti 56 ilde birinci oldu. 23 ilde ikinci parti, sadece 2 ilde 3. parti. CHP ise 37 ilde temsil edilmiyor.",true
Barış Pınarı Harekatı ve Trump’ın katıldığı açılış hakkındaki iddia,false
Schweden wird wegen Einwanderung bis 2030 ein Dritte-Welt-Land,false
...kadına dönük şiddetin tarihteki en tepe noktasına geldiğini gördük. 2015’in ilk 10 ayında 346 kadın katledildi.,mostly true
"Bugün memnuniyet ve sevinçle diyorum ki, kadın adaylara en fazla yer veren parti AK Parti’dir.",false
Ekrem İmamoğlu'nun 'İstanbul İmamlar Birliği' hakkında duyuru yaptığı iddiası,false
در برخی سال‌های اخیر دختران توانسته‌اند تا ۶۰درصد ورودی دانشگاه‌ها را از آن خود کنند,mostly true
Fotoğrafın YPG tarafından esir alınan Türk askerlerini gösterdiği iddiası,false
Alle Arbeitgeber müssen bis 31. Juli 2021 den Impfschutz ihrer Angestellten nachweisen,mostly false
Ben 2002’de Hazineden sorumlu bakan olarak başladığımda Türkiye’de faizler %66 idi. Enflasyon %29’du. Ülkede 35 yıl çift haneli enflasyon görmüştük. Tek haneli enflasyonu Türkiye’de hemen birkaç yıl içerisinde gördük.,mostly true
Türkiye’de 20 milyon  yoksulluk sınırının altında yaşıyor.,mostly true
Bizde son 15 yılda hiç krize girmeyen sektör inşaat sektörüdür.,mostly true
Eğitim bütçesinin yaklaşık yüzde 90'ını zorunlu harcamalar oluşturmaktadır.,mostly true
موسسات معتبر بین‌المللی ایران را جزو امن‌ترین کشورهای جهان برای سفر معرفی کرده‌اند.,mostly true
"TSK NATO’nun 2. büyük ordusu, dünyanın 5. büyük ordusudur",mostly false
1980-2002 arası Türkiye’nin ödediği faiz 135 milyar lira. 2002-2014 arası ödediği faiz ise 598 milyar lira,mostly true
12 yılda üreticilerimize 70 milyar lira nakit hibe desteği sağladık.,true
"Donald Trump: „„Wenn ich kandidieren würde, würde ich als Republikaner kandidieren. Sie sind die dümmste Gruppe von Wählern im Land. Sie glauben alles auf Fox News. Ich könnte lügen und sie würden es immer noch schlucken. Ich wette, meine Zahlen wären fantastisch.“",false
Enerji sepetinde yenilenebilir kaynak oranı yüzde 40'a ulaştı ve bu oran birçok AB ülkesinin üstündedir.,true
Türkiye baklagillerde net ithalatçı ülke durumundadır.,true
"Artık Türk Silahlı Kuvvetleri’mizin kahraman ordumuzun tesisat, mühimmat ihtiyacının büyük bir kısmını neredeyse % 65-70’e yakınını yerli kaynaklardan karşılıyoruz.",mostly false
In Dänemark darf die Polizei einige Hunderassen töten lassen - auch Hunde von Touristen,mostly true
Kadınların dekolte giyerek deprem yaratmaya çalıştığı iddiası,true
"Enerji alanında geldiğimiz önemli seviyeye rağmen AB müzakerelerinde tıkanan fasıllardan birinin enerji olmasını da manidar buluyorum. Eksik ne söyleyin, cevap yok.",mostly true
Vatandaşların bankalara 424 milyar borcu bulunuyor.,true
Kamudan KHK’ler ile ihraç edilenlerin 41.705’i (yüzde 31) eğitim ve yükseköğretim kurumlarından.,mostly true
Merkel will 12 Millionen Migranten ansiedeln und indigene Deutsche ersetzen.,mostly false
Skandal-Urteil in Reutlingen: 12-fache Vergewaltigung – Richter lässt syrischen Triebtäter laufen,true
Geisteskranke Antifa fackelt 5 Autos von Bademeistern und Schwimmbadangestellten ab,mostly false
Datenschutz-Irrsinn: Namen an Klingelschildern und Briefkästen möglicherweise unzulässig,false
"Eski Türkiye olsaydı, bir seçim olsaydı popülist gayelerle bütçe açığı artardı.",false
"Türkiye'de Süryanice eğitim veren okul bulunmuyor, 1928'de kapatılan son okuldan sonra bu eğitim yapılamıyor, sadece bir anaokulu var.",true
Soruların bekçi alımı için yapılan sınavda sorulduğu iddiası,true
Gana’da sahte ABD Büyükelçiliği açıldığı iddiası,true
„Nicht schon wieder – HUNDERTE VÖGEL fallen nahe einer 5G-ANLAGE tot vom Himmel!“,false
(Türkiye) 34 yıl boyunca ya 2 haneli ya da 3 haneli enflasyon dönemlerini yaşadı... tek haneli rakam 2004 yılında görüldü...2012 yılında enflasyonda ulaşılan rakamın son 44 yılın en düşük oranı,true
Asgari ücreti 184 liradan bin liraya çıkaran biziz.,true
"Kardinal George Pell habe gesagt, „Abtreibung ist schlimmer als Kindesmissbrauch“",mostly true
Video auf Facebook: bei den angreifern soll es sich um libanesen handeln. tatort soll gelsenkirchen sein!,mostly true
Erzurum'daki Hasan-ı Basri Türbesi'nin etrafına TOKİ binası yapıldığı iddiası,true
"Das Foto zeige einen Söldner, der als Kriegsflüchtling nach Deutschland komme",false
Bir ders kitabında kedilere işkenceyi konu alan soru olduğu iddiası,mostly false
Selfitis'in Amerikan Psikiyatri Derneği tarafından hastalık olarak kabul edildiği iddiası,mostly false
"Dünyanın ilk 10 ekonomisi arasına girme hedefi olan Türkiye, 17.likten 18.sıraya düşmüştür",mostly true
"Aile gelirinin borca oranı 2002’de yüzde 4,7’ydi. Şimdi bu oran yüzde 57.",mostly true
Jetzt doch ab 1. Januar: EU-Standard-Chip EPS ersetzt Personalausweis,false
"AR-GE personeli sayısı 2002 yılında 29 bin iken 2012 yılında 105 bine ulaştı. 2002 yılında özel sektör tarafından istihdam edilen AR-GE personelinin oranı yüzde 20 iken 2012 yılında yüzde 49,7'ye çıktı.",true
"Şu an hapiste olan öğrenci sayısı, AKP’nin iktidara geldiği 2002 yılındaki toplam mahpus sayısından daha fazladır.",true
Fotos von Busfahrern ohne Schutzmasken: Fahren Evakuierte nach Coronavirus-Ausbruch in Krankenhaus,mostly true
مرکز لرزه‌نگاری دولتی مکزیک اعلام کرده در لحظه گل مکزیک [به آلمان] زمین‌لرزه خفیفی در اثر بالا و پریدن ملت ثبت شده است,false
Elon Musk verlässt Tesla und investiert 700 Millionen in die Semantic App,false
İstanbul Havalimanı'nın şantiye alanını su bastığı iddiası,true
"Mayıs ayı toplam mal ihracatı, önceki yıllardaki tüm mayıs ayı rakamlarını geçerek Cumhuriyet tarihi rekorunu kırdı.",true
İmalat sanayinin gayri safi milli hasılada payı yüzde 23'ten yüzde 15'e geriledi.,mostly true
ABD’de bir vatandaş (Osman Gazi Köprüsü ile) aynı uzunluktaki köprüyü yedi dolara geçiyor.,true
700 Euro Weihnachtsgeld für Flüchtlinge.,false
"Ülkemiz hala OECD ülkelerinin doğumda beklenen yaşam süresine ulaşamamıştır, üstelik bu haliyle ulaşması da beklenmemektedir.",mostly true
"Sanayi Üretimi Endeksindeki %17,6’lık artışla Türkiye, haziran ayında Avrupa sıralamasında ilk sırada yer aldı",mostly false
"Kanal İstanbul için merkezi hükumetin harcayacağı para, Çevre ve Şehircilik Bakanlığı’nın depremden bu ülkeyi kurtaracak kentsel dönüşüme ayırdığı paranın tam 7 katıdır",true
"CHP'nin 25 yıl tek başına iktidar olduğu süre içinde sadece Ankara Üniversitesi açıldı, 13 yıllık AK Parti iktidarında ise 100'ün üzerinde üniversite açıldı.",true
Biz bunu (kişi başına düşen milli gelir) 3 bin 400 dolardan aldık 11 bin dolara çıkardık.,mostly false
1995 seçimlerinden 2011 seçimlerine kadar baktığımızda hükümet kurma görevinin yemin töreninden sonraki 3 gün içinde belirlendiğini biliyoruz.,true
"Sokağa çıkma yasaklarının hiçbir hukuki temeli yoktur. Gösterilen hukuki temel tamamen dayanaktan yoksundur… İki kanunda sokağa çıkma yasağı vardır; birisi olağanüstü haldir, diğeri sıkıyönetimdir.",true
"Din görevlileri, Boşnaklar, Arnavutlar ve Arapların Çanakkale'de savaşmadığı iddiası",mostly false
"Türkiye'nin 2016 ilk çeyrek itibarıyla toplam dış borcu 411.5 milyar dolardı. AKP iktidara geldiğinde, 2003’te, 124 milyar dolardı. Her doğan çocuk 5.137 dolar borçla dünyaya geliyor.",mostly true
Die Anwesenheit des Kindes in der Schule reicht laut WHO als Einwilligung zur Impfung,mostly true
Açık oy kullanılması Anayasa Mahkemesi tarafından iptal nedeni sayılmamakta ve (açık oy kullanmak) anayasaya aykırı değil.,false
"AB ortalamasının yüzde 35'inden, yüzde 53'üne yükselen bir refahımız var",mostly false
Tüketici güveni tarihi dip seviyede,true
"2014 yılında kadın cinayeti sayısı 281, 2015'in ilk 6.5 ayında ise 160 oldu.",mostly true
Helene Fischer tot aufgefunden.,false
در طول ۵سال گذشته آمار اشتغال خالص، ۲ میلیون و ۷۰۰هزار شغل بوده است,false
"''(Tasarruf oranları) Çin'de yüzde 52, Hindistan'da yüzde 35, AB'de ülkeye göre yüzde 22, 23, 24 olan tasarruf oranlarının Türkiye'de ise halen yüzde 13.4''",mostly true
دوره خشکسالی در ایران به پایان رسیده است و دوره ترسالی آغاز شده است.,false
"Son 50 yılın siyasi tarihine bakın, tek başına iktidarlardaki Türkiye’nin büyüme oranı, koalisyon dönemlerindekinin iki katıdır.",false
Nevşehir’in Acıgöl ilçesinde çöp kamyonunda bir köpeğin ezildiğine ilişkin iddialar,mostly false
on dört yıldır 6 kez vergi affı çıkarıldı.,true
"1986 yılında nükleerin elektrik üretimindeki payı yüzde 16’ydı, bugün yüzde 11’e düştü.",mostly true
"1990'lı yılların başında 3 cent olan elektriğin fiyatı, elektriğin piyasalaştırılması sonucu günümüzde 14 cente çıkmış durumda.",mostly true
"Weil die Renten um drei Prozent steigen, müssten künftig 48.000 Senioren ihre Rente versteuern. Damit steige die Zahl der steuerpflichtigen Rentner auf 4,98 Millionen.",mostly true
Michael Schumacher im Koma.,false
Der türkischstämmige Bundestagsabgeordnete Yergi Hiciv fordert einen Gesinnungstest für Deutsche.,false
بچه پول‌دارها به هیچ کجا نمی‌رسند و اکثرا معتاد می‌شوند.,false
"... (Türkiye) bir dönem dünyanın en önemli pamuk üreticilerinden birisiydik, şu anda dünyanın en önemli pamuk ithalatçılarından birisiyiz.",true
Türkiye'deki beş markanın ürünlerinde domuz eti kullandığı iddiası,mostly false
"Angeblicher Fyler „Kein Sex mit Nazi“, gefördert durch Bundesfamilienministerium",mostly true
پیش از تحریم‌های شدید، نرخ رشد اقتصادی را از منفی ۸درصد به ۱۴درصد رساندیم.,mostly false
"Geçen yıl aynı dönemde 1,8 milyar TL faiz dışı fazla varken, bu yıl faiz dışı bütçe açığı da 12,3 milyar TL’ ye ulaşarak yeni bir rekora imza atmıştır.",true
"Türkiye'de lezbiyen, gay, biseksüel ve transları (LGBT) hedef alan ayrımcılık ve şiddet giderek artıyor",true
"Türkiye’de 2006’da bir kanun çıkardılar, dediler ki milli gelirin yüzde birini tarıma vereceğiz. 30 milyar dolar verecekken 12 milyar dolar verdiler. Bu devlet bu çiftçiye borçludur.",mostly true
Die Lokalzeitung „Freie Presse” schreibt über eine Häufung sexueller Straftaten in Chemnitz.,true
Bizde son 15 yılda hiç krize girmeyen sektör inşaat sektörüdür.,mostly true
Dünyada 100 marka arasında bir tane Türk markası yok.,true
"So sehen ‘Menschen’ aus, die für Gruppenvergewaltigungen demonstrieren",false
Otoriter rejimlerde enflasyon oranları demokrasilerdeki ortalamanın neredeyse 20 katı.,mostly true
Corona ist nicht schlimmer als ein Grippevirus,mostly false
...devlete ve özel sektöre ait yatak kapasitesi ihtiyacın yüzde 10'unu karşılayabiliyor.,mostly true
Fotoğrafın İspanyol gribi salgınında maske takan bir kediyi gösterdiği iddiası,true
Nach Massaker in Chemnitz – Merkel betont im ARD-Sommerinterview: ‘Ich bin die Kanzlerin der Migranten’“,mostly false
"2018 yılı bütçesinde, fen lisesi inşaatları için 40 milyon lira, imam hatip lisesi için 550 milyon lira harcanmış.",true
"Hastane ve yataklı tedavi kurumu sayısını 1.156'dan 4.636'ya, Aile Sağlığı Merkezleri sayısını 9 binden 17 bine çıkarttık.",false
JEFTA-Abkommen – EU macht Wasser zur Handelsware. Nur die deutsche Wasserwirtschaft schlägt Alarm.,mostly false
Rudolf Henke will Kinder polizeilich zwangsimpfen lassen,false
"AK Parti iktidara geldiğinde milli gelir 230 milyar dolardı, kişi başı gelir ise 3 bin – 3 bin 500 dolar seviyesindeydi. Geçen yıl milli gelirimiz 720 milyar dolar oldu, (milli geliri) 3 kattan fazla arttırdık.",mostly false
Afyonkarahisar'da İYİ Partili Mahmut Koçak’ın pankartının kapatıldığı iddiası,true
Çocuk suçluluk oranları son 5 yılda yüzde 100 arttı..,mostly true
Çin'de iki günde hastane inşa edildiği iddiası,false
"Derlenen verilere göre, 2008’de 256 bin (…) 2017 yılında 600 bin dolayında olan hırsızlık vakası toplumu can ve mal güvenliği açısından tedirgin etmektedir.",mostly true
Aussagen aus dem AfD-Wahlprogramm für Sachsen,mostly true
دریادار حبیب‌الله سیاری بازداشت شده و تحت شکنجه قرار دارد.,false
"Das Pentagon wolle deutsches Kriegsschiff an ihrer Seite, bei einem möglichen Angriff auf Syrien.",false
... son 3 yılda hırsızlık ve yolsuzluk gibi olaylar yüzde 68 nispetinde artarak 50 binden 84 bine ulaştı.,mostly true
"2013 yılındaki 407 bin iş davasının 190 bini sonuçlandırıldı, 217 bini sonraki yıla devretti.",mostly true
Von 70 Flüchtlingen ist nach einem Jahr nur noch einer im Betrieb tätig.,mostly false
2013'te bir eylemde karşı karşıya gelen Desi ve Ivan'ın hikayesi,true
Özel sektör firmalarının borcu öz kaynaklarının yüzde 175'ine ulaşmıştır.,mostly true
"Yani CHP’nin son 55 yıl içinde tarihi zafer diye andığı 77 seçimleri tek başarı hikayesi, birinci çıktı, şu anda bizim ulaştığımız çizginin altındadır.",mostly true
"2011’de yakalanan bonzai 44 kiloydu, 2013’te 350 kilo yakalandı",mostly false
Sağlık Bakanlığı gizli ibaresiyle dolaşıma sokulan metni yayınlamadı,false
"Türkiye’nin nüfusu 78 milyon, acile başvuru 112 milyon.",true
Ateş ölçüm cihazlarının epifiz bezine zarar verdiği iddiası,false
"2002 yılından 2014 yılına kadar girdi ve gübre fiyatlarında yüzde 300, yüzde 400'e yakın artışlar yaşandı.",true
Erdoğan'ın katılacağı törene Dilovası Belediyesi çalışanlarının aileleriyle katılması zorunlu tutuldu iddiası,true
Berechnung zum CO2-Anteil in der Luft und zum Klimawandel,false
"CHP’nin Genel Müdürü televizyona çıkıyor, ne diyor? (Kürt sorunu için) 17 çözüm önerimiz var diyor, birinciyi söylüyor, ikinciye gelince unuttum diyor. Sonradan anlaşıldı ki, madde sayısı da 17 değil 19’muş, bunu da hatırlamıyor",mostly false
"2014 yılı durgunluğun, enflasyonun, işsizliğin ve borçların tırmandığı bir yıl olarak...",mostly false
۷۰ درصد از عملکرد پرسنل قضایی رضایت نسبی و ۴۰ تا ۴۵ درصد رضایت زیاد و خیلی زیاد دارند.,false
"Çin’in, İsrail’in ihracatının üçte birini, yüksek teknolojili ürünler oluştururken, bizim ihracatımızda, yüksek teknolojili ürünlerin oranı yüzde beş bile değil",mostly true
"Her sene 1,6-1,7 milyon Z kuşağından yeni seçmen devreye giriyor",mostly false
2002 yılına kadar savunma sanayinin yüzde 80’i ithalatla karşılanıyordu.,mostly true
Bakan Pakdemirli'nin patates firmasında danışmanlık yaptığı iddiası,true
"Suriye’den gelen 247 bin kişi kampta, 500 bin civarında kişi de yurt içine dağılmış vaziyette",mostly true
Kinder verschwinden und landen in Farmen für Menschenfleisch,false
Türkiye Avrupa’da boşanma hızının en düşük olduğu ülkeler arasında.,mostly true
on dört yıldır 6 kez vergi affı çıkarıldı.,true
Ankara’da asbestli su borularının yenilenmesinin AK Partili ve MHP’li üyelerin oylarıyla reddedildiği iddiası,true
اعتبار علمی و سوابق مهران توکلی کشه و ادعاهایش درباره درمان کرونا با «آب گنس»,false
Türkiye'de her gün yaklaşık 10 kişi intihar ediyor. Halkın psikolojisi bozuldu. Bu devirde imam intihar ediyorsa cemaat ne yapmaz?,mostly false
Erfundene Party-Exzesse: Die Mär vom Mallorca-Corona-Hotspot,mostly false
Özel şirketlerin borcu 10 kat artmış.,false
A Haber'in ABD'yi TL korkusu sardı şeklinde bir alt bant kullandığı iddiası,true
In Frankreich herrscht bereits Krieg: Medien schweigen,mostly false
''Toptan ve perakende ticaret sektöründe 1 milyon 800 bin kişi istihdam edilmektedir.'',mostly false
در برخی سال‌های اخیر دختران توانسته‌اند تا ۶۰درصد ورودی دانشگاه‌ها را از آن خود کنند,mostly true
“Dalai Lama warnt vor zu vielen Migranten: Europa darf nicht muslimisch oder afrikanisch werden“,mostly true
"Bakterien, Viren sowie Keime aus der Mundhöhle, gelangen durch die Maske in die Lunge",mostly false
"Erdoğan, Vikipedi'de Kendi kendine darbe yapan liderler listesinde iddiası",mostly false
Biz bunu (kişi başına düşen milli gelir) 3 bin 400 dolardan aldık 11 bin dolara çıkardık.,mostly false
"İstanbul dünyanın en çok nüfusa sahip 15. kenti, GSYH’nin dörtte birini üreten, vergilerin %40'ını veren, tek başına bir ülke olsaydı dünyanın en büyük 25-30 ekonomisinden biri olurdu.",mostly true
"Im Reinhardswald soll gerodet werden, Schuld sind die Grünen",mostly false
Daha önce bizim yasalarımızda nafaka bir yılmış. Sonradan yasal bir değişiklik olmuş ve süresiz nafakaya dönüşmüş. … Avrupa’da süresiz nafaka yok.,mostly false
İran Şahı Nasreddin'in haremine ait olduğu iddia edilen fotoğraflar,true
Vergleich: Im Jahr 2017/18 gab es 25.000 Grippetote und bisher erst 3000 Corona-Tote,mostly false
"Borcun, milli gelire oranı yüzde 30'un altında. Avrupa ülkelerinin borcunun milli gelire oranı Türkiye'nin 3 katı, bütçe açıkları Türkiye'nin 3 katı.",mostly true
(24 Şubat 2015’te Malatya’da düşen iki F-4 uçağıyla ilgili) Pilotların kullandığı uçaklar dünyanın hiçbir bölgesinde kullanılmıyor.,mostly false
Zwei Bilder zeigen angeblich inhaftierte Uiguren in China,false
227 bal ormanı var. Şimdi Türkiye dünyada bal üretiminde ikinci sıraya yükseldi.,true
Corona-Todesraten für verschiedene Länder in Prozent,mostly false
"2023 senesine yaklaşırken Türkiye, dünyanın en büyük 10 ekonomisi olması gibi bir hedef koymuştuk. Bugünlerde ilk 20’den dışarı çıkma tehlikesiyle karşı karşıyayız.",mostly false
Rumeli Hisarı'na mescit yapıldığı iddiası,true
İstanbul’da mahalle statüsüne geçen köylerdeki su zammı iddiası,mostly false
"Sadece Dolar/Euro artmıyor; iç savaşın devam ettiği Suriye'nin Lirası, ambargo uygulanan İran'ın Riyali, çatışmaların sürdüğü Libya'nın Dinarı, fiili olarak üçe bölünen Irak'ın Dinarı ve borç aldığımız Çin'in Yuanı bile şu an TL karşısında değer kazanıyor.",true
Suriyeli mültecilere içinde 930 TL bulunan yardım kartı verildiği iddiası,mostly false
Merkez Bankası'ndaki rezervimiz de 117 milyar dolar seviyesine çıkmış bulunuyor.,true
Dünyanın kız çocuklara en kötü davranan 6'ncı ülkesiyiz.,mostly true
Türkiye yolsuzluk algısında rekor puan kaybedip en kötü şekilde gerileyen ülke,mostly true
Gericht bestätigt: AfD-Mitglieder jetzt offiziell „alle“ Nazis!,mostly false
„Corona-Regeln: Sachsen droht Eltern mit Kindesentzug“,mostly true
77’den bu yana 41 yıl sonra 30 barajını geçmişiz.,true
"En borçlu ilk 5 il AKP, bağımsız istatistiklerde de rahatlıkla görüleceği üzere mutlu, yaşanabilir kentlerin çoğunluğu ise CHP'li belediye başkanlarıyla yönetiliyor.",mostly true
Türkiye iş cinayetlerine rekora koşuyor. Sadece Ağustos ayında 158 işçi hayatını yitirdi.,mostly true
"Değerli vatandaşlarım, bakın 12 yılda yarattıkları tablodan satır başları vereceğim size; 6 milyon 200 bin işsiz.",mostly true
Videonun Afrin'deki sıcak çatışmaları gösterdiği iddiası,false
"Türkiye’de 2006’da bir kanun çıkardılar, dediler ki milli gelirin yüzde birini tarıma vereceğiz. 30 milyar dolar verecekken 12 milyar dolar verdiler. Bu devlet bu çiftçiye borçludur.",mostly true
Durch das Bestehen auf Bargeldzahlung kann man den Rundfunkbeitrag sparen.,mostly false
Italienisches Lied auf Youtube: Jeder Klick ist eine Spende an ein Krankenhaus in Bergamo,mostly false
Dünyanın kız çocuklara en kötü davranan 6'ncı ülkesiyiz.,mostly true
ARD und ZDF haben nicht über Mord mit Schwert in Stuttgart berichtet,false
زمین بایر پتروشیمی دهدشت و سهامی که طی یک سال چند برابر شده است.,mostly true
Weihnachtsmarkt in Berlin im Käfig,mostly false
Video: Markus Frohnmaier (AfD): Gender-Gaga: Wofür unsere Steuergelder verschwendet werden! (04:02),mostly false
Türkiye'nin 2018'de 'yarı-özgür ülke' statüsünden 'özgür olmayan ülke' statüsüne gerilediği iddiası,true
2002’de AKP’den önce 15 bin taşeron çalışıyordu devlet kademelerinde. Bugün 661 bin olmuş.,mostly true
"Tarım sektörü 2016’nın üçüncü çeyreğinde yüzde 7,7 küçüldü.",true
"İhracatta 6 milyar, turizmde 6-7 milyar dolar Rusya'dan gelir elde ediyoruz. Bir de bavul ticareti var; 2013'te 8,5 milyar, 2014'te 6 milyar dolara düşen bir tablo. Kriz derinleşirse, Türkiye'nin 20 milyar dolar kaybı olacağı göz önünde bulundurulmalı.",mostly true
Der unverbindliche Migrationspakt – plötzlich doch verbindlich!,mostly false
هر چقدر درخت و مرتع بیشتر باشد ابر بیشتر می‌بارد؛ وقتی زمین خشک است، ابر هم رد می‌شود و می‌رود جای دیگری می‌بارد.,false
Angeblicher Tweet von syrischem Flüchtling Dawuhd Nabil,false
"Niemand ist in Hamburg an Corona gestorben. In Italien sind 96 Prozent der Corona-Toten an anderen Ursachen gestorben. Das RKI hat Apotheken verboten, Antikörpertests zu verkaufen.",mostly false
Jobcenter-Bescheid an Flüchtlingsfamilie,mostly false
Google'ın Müslümanlar için Doodle hazırlamadığı iddiası doğru değil,false
"Nasıl Türkiye’de bir işsizlik var, Türkiye’den daha çok işsizlik Almanya’da, İngiltere’de, İspanya’da var.",mostly false
Osmanlı'da 623 yılda yalnızca 2 tecavüz ve 27 hırsızlık vakasının yaşandığı iddiası,false
"T-20 toplantısında, diğer ülkeler turizm gelirlerinde yüzde 20'leri aşan düşüşlerden bahsederken, Türkiye'nin bu ay itibarıyla düşüşü sadece binde 8'dir.",false
Die AfD bietet Teilnehmern einer Demo finanzielle Unterstützung an.,true
Ülkemiz bugün ... rekor düzeyde büyüyen ekonomisi ...  ile dünyanın önde gelen ülkeleri arasında yerini almıştır.,false
